sku,title,description,price,retail_price,images,category,sub_category,brand,width,height,depth,location
10239149,1980s Vintage Custom Square Metal Bronze Coffee Table With Geometric Copper and Silver Square and Rectangular Patterns,"Found this unique vintage gem at an auction in Southern California, was visiting beaches and photographing coastal views. During viewing the session I found this coffee table and was struck by the geometric patterns and searched for examples of this on my phone, what I found surprised me - it can be found in various cultures and time periods, including ancient civilizations like the Egyptians and Greeks, as well as modern and contemporary art movements. Wow. I read on,Geometric art often emphasizes symmetry, order, and precision. It explores the relationships between shapes, lines, colors, and proportions. Artists working in this style may use basic geometric shapes such as squares, circles, triangles, or more complex forms like polygons, spirals, or fractals. Wow.
That sold me,  not only is the piece striking, optically pleasant but structurally sound. All metal, including the legs. I lifted one side, it was heavy then I looked at the underside and discovered that the legs can be taken apart held together by hex nuts and bolts. Very sturdy. I decided I had to have that piece and my wife agreed. Wow. We waited for a while before the lot came up and the bidding began. The bidding war began slowly and build into a frenzy (don&#x27;t they always) in the end I took it apart and loaded it onto my pickup truck. Came home a winner.",1389,,"['https://chairish-prod.freetls.fastly.net/image/product/sized/69d5599d-d71c-4830-85eb-f2bcec5126a5/1980s-vintage-custom-square-metal-bronze-coffee-table-with-geometric-copper-and-silver-square-and-rectangular-patterns-1222', 'https://chairish-prod.freetls.fastly.net/image/product/sized/f6c29eb2-96f3-4a5c-ab21-9637e418dcf2/1980s-vintage-custom-square-metal-bronze-coffee-table-with-geometric-copper-and-silver-square-and-rectangular-patterns-6584', 'https://chairish-prod.freetls.fastly.net/image/product/sized/c4a297b5-4223-4fd7-94bb-f40b8698a98f/1980s-vintage-custom-square-metal-bronze-coffee-table-with-geometric-copper-and-silver-square-and-rectangular-patterns-2836', 'https://chairish-prod.freetls.fastly.net/image/product/sized/f34fc3ca-15d9-4167-ab6a-1d61f70cd1b1/1980s-vintage-custom-square-metal-bronze-coffee-table-with-geometric-copper-and-silver-square-and-rectangular-patterns-4820', 'https://chairish-prod.freetls.fastly.net/image/product/sized/8577d9b9-e5ad-4ede-8c55-ec16ef331ee9/1980s-vintage-custom-square-metal-bronze-coffee-table-with-geometric-copper-and-silver-square-and-rectangular-patterns-0309', 'https://chairish-prod.freetls.fastly.net/image/product/sized/801cfbf4-7313-4992-920c-71cb42bfe307/1980s-vintage-custom-square-metal-bronze-coffee-table-with-geometric-copper-and-silver-square-and-rectangular-patterns-4903', 'https://chairish-prod.freetls.fastly.net/image/product/sized/f4569e9d-e03f-498d-a244-2ce47526c469/1980s-vintage-custom-square-metal-bronze-coffee-table-with-geometric-copper-and-silver-square-and-rectangular-patterns-0896', 'https://chairish-prod.freetls.fastly.net/image/product/sized/a2e944b6-8d08-4981-992c-631bd88370c6/1980s-vintage-custom-square-metal-bronze-coffee-table-with-geometric-copper-and-silver-square-and-rectangular-patterns-9722', 'https://chairish-prod.freetls.fastly.net/image/product/sized/d4874e79-1dc1-4f0f-aed4-ed436095a6ec/1980s-vintage-custom-square-metal-bronze-coffee-table-with-geometric-copper-and-silver-square-and-rectangular-patterns-3866', 'https://chairish-prod.freetls.fastly.net/image/product/sized/e159ab3c-bed2-4b38-b21c-f15966a04c6b/1980s-vintage-custom-square-metal-bronze-coffee-table-with-geometric-copper-and-silver-square-and-rectangular-patterns-8537', 'https://chairish-prod.freetls.fastly.net/image/product/sized/c01c234d-6595-464a-83b0-0580081e17a7/1980s-vintage-custom-square-metal-bronze-coffee-table-with-geometric-copper-and-silver-square-and-rectangular-patterns-6572', 'https://chairish-prod.freetls.fastly.net/image/product/sized/69d5599d-d71c-4830-85eb-f2bcec5126a5/1980s-vintage-custom-square-metal-bronze-coffee-table-with-geometric-copper-and-silver-square-and-rectangular-patterns-1222']",Furniture,Tables,,42,18,42,"Colorado Springs, CO"
2516249,19th Century French Louis XV Style Serpentine Commode,"19th century French Louis XV style serpentine commode mahogany veneer three drawer carved details dove tails joints original brass hardware.
 Gorgeous piece in great vintage condition. Solid and firm. The front has three spots where the veneer has chipped off and also on top has a spot missing. Please keep in mind that this is a vintage piece and has its normal signs of wear. This is what gives its character and confirms its age. Note: Please use photos as part of the description.",850,,"['https://chairish-prod.freetls.fastly.net/image/product/sized/65cc699e-1dbe-4c13-9d37-9c1cdef29d01/19th-century-french-louis-xv-style-serpentine-commode-3880', 'https://chairish-prod.freetls.fastly.net/image/product/sized/210f0613-2acc-401f-84d6-7c8e95fde7f5/19th-century-french-louis-xv-style-serpentine-commode-1115', 'https://chairish-prod.freetls.fastly.net/image/product/sized/60f90826-c07d-4b83-b7a8-a3491c6c31e9/19th-century-french-louis-xv-style-serpentine-commode-5671', 'https://chairish-prod.freetls.fastly.net/image/product/sized/f73bb522-37fa-4136-86c6-38f6c5ed38b9/19th-century-french-louis-xv-style-serpentine-commode-6743', 'https://chairish-prod.freetls.fastly.net/image/product/sized/bfdcb0e5-4fcd-4b75-81eb-b5554c2ae42b/19th-century-french-louis-xv-style-serpentine-commode-0110', 'https://chairish-prod.freetls.fastly.net/image/product/sized/b508e10b-e353-4e04-b137-81397db1bc18/19th-century-french-louis-xv-style-serpentine-commode-2291', 'https://chairish-prod.freetls.fastly.net/image/product/sized/8bcf6d33-6f90-4969-a315-3715e8ba296f/19th-century-french-louis-xv-style-serpentine-commode-0912', 'https://chairish-prod.freetls.fastly.net/image/product/sized/69765937-13d0-44d7-96d7-87137d4e953f/19th-century-french-louis-xv-style-serpentine-commode-7451', 'https://chairish-prod.freetls.fastly.net/image/product/sized/d2e693c1-b697-4fea-95c1-5559d3e9928f/19th-century-french-louis-xv-style-serpentine-commode-6035', 'https://chairish-prod.freetls.fastly.net/image/product/sized/22aba56e-af9b-4246-b4fb-8285a6d722b4/19th-century-french-louis-xv-style-serpentine-commode-1220', 'https://chairish-prod.freetls.fastly.net/image/product/sized/2812a9a3-8787-44bc-8f8a-de358c139701/19th-century-french-louis-xv-style-serpentine-commode-4766', 'https://chairish-prod.freetls.fastly.net/image/product/sized/6dbcd706-3027-4537-b628-05da3833f61a/19th-century-french-louis-xv-style-serpentine-commode-2884', 'https://chairish-prod.freetls.fastly.net/image/product/sized/65cc699e-1dbe-4c13-9d37-9c1cdef29d01/19th-century-french-louis-xv-style-serpentine-commode-3880']",Furniture,Casegoods & Storage,,54,34,23,"Colorado Springs, CO"
14433251,1920s Royal Furniture by Robert Irwin Four Drawer Chest One Drawer Nightstand Original Hardware Dovetail Joinery - Set of 2,"In exquisite crotch walnut pieces, displaying spectacular flame-like grain, this dresser and nightstand by Robert W. Irwin Furniture Company are excellent examples of its time and design era. Features timeless and elegant design, with matchbook veneered front that the quality reaches out to those who appreciate fine furniture. Includes brass mounted hardware, carved accents, and pressed flourishes. Featuring a four-drawer chest and one drawer nightstand of dovetail construction. These pieces are pristine and RARE!  Circa 1920-1936.

Nightstand dimensions: 18W x 14.5D x 29H",2500,,"['https://chairish-prod.freetls.fastly.net/image/product/sized/72d1cb81-139d-4ec8-8be2-122ae66262d4/1920s-royal-furniture-by-robert-irwin-four-drawer-chest-one-drawer-nightstand-original-hardware-dovetail-joinery-set-of-2-4201', 'https://chairish-prod.freetls.fastly.net/image/product/sized/15a6c0c6-b019-4c51-b461-4fd20d0ee8a3/1920s-royal-furniture-by-robert-irwin-four-drawer-chest-one-drawer-nightstand-original-hardware-dovetail-joinery-set-of-2-8271', 'https://chairish-prod.freetls.fastly.net/image/product/sized/60723eaf-8036-4fab-a875-a9053f131bfc/1920s-royal-furniture-by-robert-irwin-four-drawer-chest-one-drawer-nightstand-original-hardware-dovetail-joinery-set-of-2-0378', 'https://chairish-prod.freetls.fastly.net/image/product/sized/7b9fbb86-99c7-473c-89a3-e0f382d7d510/1920s-royal-furniture-by-robert-irwin-four-drawer-chest-one-drawer-nightstand-original-hardware-dovetail-joinery-set-of-2-5081', 'https://chairish-prod.freetls.fastly.net/image/product/sized/4325df82-d126-4857-a20f-5b6135ec7b4a/1920s-royal-furniture-by-robert-irwin-four-drawer-chest-one-drawer-nightstand-original-hardware-dovetail-joinery-set-of-2-1155', 'https://chairish-prod.freetls.fastly.net/image/product/sized/f0410026-667d-49e0-a649-397b6ec82f3f/1920s-royal-furniture-by-robert-irwin-four-drawer-chest-one-drawer-nightstand-original-hardware-dovetail-joinery-set-of-2-5295', 'https://chairish-prod.freetls.fastly.net/image/product/sized/230c1e83-88c9-47a8-aa77-35deb9daf51b/1920s-royal-furniture-by-robert-irwin-four-drawer-chest-one-drawer-nightstand-original-hardware-dovetail-joinery-set-of-2-1523', 'https://chairish-prod.freetls.fastly.net/image/product/sized/6c22d4dd-103e-4386-acd5-46a0f1afb854/1920s-royal-furniture-by-robert-irwin-four-drawer-chest-one-drawer-nightstand-original-hardware-dovetail-joinery-set-of-2-8676', 'https://chairish-prod.freetls.fastly.net/image/product/sized/a342931c-18e6-4930-b13d-3658448b84ba/1920s-royal-furniture-by-robert-irwin-four-drawer-chest-one-drawer-nightstand-original-hardware-dovetail-joinery-set-of-2-5401', 'https://chairish-prod.freetls.fastly.net/image/product/sized/ab2316c4-f122-4469-becd-c239a23b9931/1920s-royal-furniture-by-robert-irwin-four-drawer-chest-one-drawer-nightstand-original-hardware-dovetail-joinery-set-of-2-9283', 'https://chairish-prod.freetls.fastly.net/image/product/sized/3c32a451-4022-4630-8087-2f730f912812/1920s-royal-furniture-by-robert-irwin-four-drawer-chest-one-drawer-nightstand-original-hardware-dovetail-joinery-set-of-2-4086', 'https://chairish-prod.freetls.fastly.net/image/product/sized/5c650ae4-cc57-40e8-8a0f-a6d0d4d08597/1920s-royal-furniture-by-robert-irwin-four-drawer-chest-one-drawer-nightstand-original-hardware-dovetail-joinery-set-of-2-3799', 'https://chairish-prod.freetls.fastly.net/image/product/sized/72d1cb81-139d-4ec8-8be2-122ae66262d4/1920s-royal-furniture-by-robert-irwin-four-drawer-chest-one-drawer-nightstand-original-hardware-dovetail-joinery-set-of-2-4201']",Furniture,Casegoods & Storage,,44,34,22,"Colorado Springs, CO"
4418434,Vintage French Louis XV-Style Tall Back Suede Bergere Chairs & Cabriole Legs - a Pair,"Vintage French Louis XV Style Tall Back Suede Bergere Chairs Cabriole Legs - a Pair
Seat and back upholstered with tan suede upholstery. Wood frame accented with nail head trim and beautifully carved scrolled details. Seats reinforced with metal springs",2500,,"['https://chairish-prod.freetls.fastly.net/image/product/sized/59ad8f2b-8382-429c-a783-b77c88e41d9c/vintage-french-louis-xv-style-tall-back-suede-bergere-chairs-and-cabriole-legs-a-pair-2231', 'https://chairish-prod.freetls.fastly.net/image/product/sized/274e27d0-4c85-42b3-b6f6-3d368b1b9680/vintage-french-louis-xv-style-tall-back-suede-bergere-chairs-and-cabriole-legs-a-pair-8268', 'https://chairish-prod.freetls.fastly.net/image/product/sized/ecbd008f-cd19-4563-a350-ccdeae604337/vintage-french-louis-xv-style-tall-back-suede-bergere-chairs-and-cabriole-legs-a-pair-7009', 'https://chairish-prod.freetls.fastly.net/image/product/sized/81aa0cc3-7c66-4821-97b7-6e047ed88203/vintage-french-louis-xv-style-tall-back-suede-bergere-chairs-and-cabriole-legs-a-pair-6016', 'https://chairish-prod.freetls.fastly.net/image/product/sized/c41454ce-1f06-4a87-ada2-df2a4863fc57/vintage-french-louis-xv-style-tall-back-suede-bergere-chairs-and-cabriole-legs-a-pair-7524', 'https://chairish-prod.freetls.fastly.net/image/product/sized/9ba01785-cfbd-4223-a228-d496cbcb44ab/vintage-french-louis-xv-style-tall-back-suede-bergere-chairs-and-cabriole-legs-a-pair-0145', 'https://chairish-prod.freetls.fastly.net/image/product/sized/77fdbcaa-a513-4d88-b4d8-a8ef24417cd2/vintage-french-louis-xv-style-tall-back-suede-bergere-chairs-and-cabriole-legs-a-pair-0791', 'https://chairish-prod.freetls.fastly.net/image/product/sized/d7ad5e58-c142-462a-96ce-ccddcb232cb6/vintage-french-louis-xv-style-tall-back-suede-bergere-chairs-and-cabriole-legs-a-pair-2268', 'https://chairish-prod.freetls.fastly.net/image/product/sized/6a99c517-5d1c-446a-a534-9455a830bc7e/vintage-french-louis-xv-style-tall-back-suede-bergere-chairs-and-cabriole-legs-a-pair-3214', 'https://chairish-prod.freetls.fastly.net/image/product/sized/d351b978-1162-40ff-a4d7-0037d78935db/vintage-french-louis-xv-style-tall-back-suede-bergere-chairs-and-cabriole-legs-a-pair-7460', 'https://chairish-prod.freetls.fastly.net/image/product/sized/104b98a6-ce69-44d5-afbb-e546203a5434/vintage-french-louis-xv-style-tall-back-suede-bergere-chairs-and-cabriole-legs-a-pair-8195', 'https://chairish-prod.freetls.fastly.net/image/product/sized/59ad8f2b-8382-429c-a783-b77c88e41d9c/vintage-french-louis-xv-style-tall-back-suede-bergere-chairs-and-cabriole-legs-a-pair-2231']",Furniture,Seating,,25,43,29,"Colorado Springs, CO"
4596177,1990s Vintage Expedition Cabinet Moorish Style by Drexel,"Circa 1990s Display Cabinets, &quot;Expedition by Drexel&quot; Moorish Styled Arched Beveled Glass Doors Recessed Ambient Lighting Thick Tempered Glass Shelves.
Pointed arches, repeated striated markings and a painted finish accents these cabinets like no other, I have seen. You can feel the Moorish art style more closely if you come up close, feel the painted finish with your hands. Travel the rounded arches coming to a point on the doors with your eyes, feel the notches of the subtle striated markings and touch the mocha colored skin of the cabinets notice their smoothness. Know that this is a representation coming together to form art and function. What better way to live…",2500,,"['https://chairish-prod.freetls.fastly.net/image/product/sized/9e13e16b-3532-4dbe-9844-ee55f11ea1d0/1990s-vintage-expedition-cabinet-moorish-style-by-drexel-9308', 'https://chairish-prod.freetls.fastly.net/image/product/sized/79515afa-98b8-41e3-af5d-86bddd255c06/1990s-vintage-expedition-cabinet-moorish-style-by-drexel-6733', 'https://chairish-prod.freetls.fastly.net/image/product/sized/f6c805e4-171f-4897-bd92-f23b9212179e/1990s-vintage-expedition-cabinet-moorish-style-by-drexel-8036', 'https://chairish-prod.freetls.fastly.net/image/product/sized/6c8d1884-ecde-4dab-b427-806dcce823da/1990s-vintage-expedition-cabinet-moorish-style-by-drexel-1204', 'https://chairish-prod.freetls.fastly.net/image/product/sized/ec3c6315-e3af-4850-9439-c471c7777a60/1990s-vintage-expedition-cabinet-moorish-style-by-drexel-2731', 'https://chairish-prod.freetls.fastly.net/image/product/sized/0f39c484-d034-45d2-bf08-ad547cd41623/1990s-vintage-expedition-cabinet-moorish-style-by-drexel-2146', 'https://chairish-prod.freetls.fastly.net/image/product/sized/332dccc8-f68b-4bd9-8a5f-7ccc3f8d01ab/1990s-vintage-expedition-cabinet-moorish-style-by-drexel-5242', 'https://chairish-prod.freetls.fastly.net/image/product/sized/a9472461-83d3-4e3c-8c48-faec9e91d711/1990s-vintage-expedition-cabinet-moorish-style-by-drexel-0272', 'https://chairish-prod.freetls.fastly.net/image/product/sized/5a96f66a-2a2f-43db-a25a-10f39e56f968/1990s-vintage-expedition-cabinet-moorish-style-by-drexel-5927', 'https://chairish-prod.freetls.fastly.net/image/product/sized/f2e9469f-3240-4fec-81c9-b73b623c243b/1990s-vintage-expedition-cabinet-moorish-style-by-drexel-8653', 'https://chairish-prod.freetls.fastly.net/image/product/sized/74ee72a7-71ff-4fa7-8441-81cce78217cf/1990s-vintage-expedition-cabinet-moorish-style-by-drexel-8338', 'https://chairish-prod.freetls.fastly.net/image/product/sized/3448e64a-48ab-4c7e-93e5-1200f75fa8b9/1990s-vintage-expedition-cabinet-moorish-style-by-drexel-9164', 'https://chairish-prod.freetls.fastly.net/image/product/sized/9e13e16b-3532-4dbe-9844-ee55f11ea1d0/1990s-vintage-expedition-cabinet-moorish-style-by-drexel-9308']",Furniture,Casegoods & Storage,Drexel,32,81,15,"Colorado Springs, CO"
5282736,1980s Maple and Rattan Polynesian Tommy Bahama Styled Eleven Drawer Dresser With Woven Raffia Palm Fronts Brass Pulls Fluted Columns and Bun Feet,"An eclectic Polynesian eleven drawer dressers with all the bells and whistles of British West Indies styling and not to mention Tommy Bahama crafted details is in good condition and can adorn your bedroom like very few pieces can. Crafted in maple and rattan, combined with an ageless look its storage capacity of eleven drawers in unimaginable and functional.  So if you like margaritas and looking out at sunsets this stylish piece is waiting for you.",2195,,"['https://chairish-prod.freetls.fastly.net/image/product/sized/b5b28a2e-1a98-4131-a8ea-83195eb2f7ed/1980s-maple-and-rattan-polynesian-tommy-bahama-styled-eleven-drawer-dresser-with-woven-raffia-palm-fronts-brass-pulls-fluted-columns-and-bun-feet-1873', 'https://chairish-prod.freetls.fastly.net/image/product/sized/0b5fe8d1-f9fc-4bc4-b9e8-88af3f251f48/1980s-maple-and-rattan-polynesian-tommy-bahama-styled-eleven-drawer-dresser-with-woven-raffia-palm-fronts-brass-pulls-fluted-columns-and-bun-feet-7751', 'https://chairish-prod.freetls.fastly.net/image/product/sized/9c97db6f-5b80-49ac-821b-d3972e3df7be/1980s-maple-and-rattan-polynesian-tommy-bahama-styled-eleven-drawer-dresser-with-woven-raffia-palm-fronts-brass-pulls-fluted-columns-and-bun-feet-1589', 'https://chairish-prod.freetls.fastly.net/image/product/sized/0cdfecd8-d5a5-464a-acc9-b702ff42a2ba/1980s-maple-and-rattan-polynesian-tommy-bahama-styled-eleven-drawer-dresser-with-woven-raffia-palm-fronts-brass-pulls-fluted-columns-and-bun-feet-9541', 'https://chairish-prod.freetls.fastly.net/image/product/sized/70e50833-f114-4ced-9ada-08c8d6a62169/1980s-maple-and-rattan-polynesian-tommy-bahama-styled-eleven-drawer-dresser-with-woven-raffia-palm-fronts-brass-pulls-fluted-columns-and-bun-feet-0057', 'https://chairish-prod.freetls.fastly.net/image/product/sized/cf962026-c54b-4e5c-9e55-a425b771b716/1980s-maple-and-rattan-polynesian-tommy-bahama-styled-eleven-drawer-dresser-with-woven-raffia-palm-fronts-brass-pulls-fluted-columns-and-bun-feet-8065', 'https://chairish-prod.freetls.fastly.net/image/product/sized/40ce9923-e64b-4d4e-acc8-d648105cf0cd/1980s-maple-and-rattan-polynesian-tommy-bahama-styled-eleven-drawer-dresser-with-woven-raffia-palm-fronts-brass-pulls-fluted-columns-and-bun-feet-4484', 'https://chairish-prod.freetls.fastly.net/image/product/sized/40133aec-d15b-49fe-aed6-5c866041b791/1980s-maple-and-rattan-polynesian-tommy-bahama-styled-eleven-drawer-dresser-with-woven-raffia-palm-fronts-brass-pulls-fluted-columns-and-bun-feet-6426', 'https://chairish-prod.freetls.fastly.net/image/product/sized/e491f052-b119-4821-849a-7f5d22b7b238/1980s-maple-and-rattan-polynesian-tommy-bahama-styled-eleven-drawer-dresser-with-woven-raffia-palm-fronts-brass-pulls-fluted-columns-and-bun-feet-6132', 'https://chairish-prod.freetls.fastly.net/image/product/sized/2aa922e1-77ca-494f-8682-f914d04262c8/1980s-maple-and-rattan-polynesian-tommy-bahama-styled-eleven-drawer-dresser-with-woven-raffia-palm-fronts-brass-pulls-fluted-columns-and-bun-feet-0738', 'https://chairish-prod.freetls.fastly.net/image/product/sized/1e392824-342e-4229-b2a1-962be58c194e/1980s-maple-and-rattan-polynesian-tommy-bahama-styled-eleven-drawer-dresser-with-woven-raffia-palm-fronts-brass-pulls-fluted-columns-and-bun-feet-7257', 'https://chairish-prod.freetls.fastly.net/image/product/sized/74e0d136-7ce2-4ec7-b57e-27a7a0dbbab4/1980s-maple-and-rattan-polynesian-tommy-bahama-styled-eleven-drawer-dresser-with-woven-raffia-palm-fronts-brass-pulls-fluted-columns-and-bun-feet-8194', 'https://chairish-prod.freetls.fastly.net/image/product/sized/b5b28a2e-1a98-4131-a8ea-83195eb2f7ed/1980s-maple-and-rattan-polynesian-tommy-bahama-styled-eleven-drawer-dresser-with-woven-raffia-palm-fronts-brass-pulls-fluted-columns-and-bun-feet-1873']",Furniture,Casegoods & Storage,,69,37,18,"Colorado Springs, CO"
2449875,Vintage Mid-Century Modern Bentwood Bamboo Rattan Armchairs - Set of 4,Set of four vintage mid-century modern bentwood bamboo rattan armchairs. Gorgeous chairs in great vintage condition. Solid and firm. Wear is usual for its age. Please see photos. Overall gorgeous chairs that you will love having in your home!!,1000,,"['https://chairish-prod.freetls.fastly.net/image/product/sized/eb673093-efbd-4f82-92d0-1e571a133412/vintage-mid-century-modern-bentwood-bamboo-rattan-armchairs-set-of-4-3365', 'https://chairish-prod.freetls.fastly.net/image/product/sized/cc770c3b-a033-46a2-8031-8a3be2854225/vintage-mid-century-modern-bentwood-bamboo-rattan-armchairs-set-of-4-3415', 'https://chairish-prod.freetls.fastly.net/image/product/sized/e5c06bb2-aab1-46e1-9984-c67ac73cddf9/vintage-mid-century-modern-bentwood-bamboo-rattan-armchairs-set-of-4-7701', 'https://chairish-prod.freetls.fastly.net/image/product/sized/a7969707-3b48-402b-be65-57c34cfa243e/vintage-mid-century-modern-bentwood-bamboo-rattan-armchairs-set-of-4-2625', 'https://chairish-prod.freetls.fastly.net/image/product/sized/fb3f6c12-f3b9-4787-bc51-e66d3a5c34de/vintage-mid-century-modern-bentwood-bamboo-rattan-armchairs-set-of-4-3036', 'https://chairish-prod.freetls.fastly.net/image/product/sized/23f0fae0-2533-4f46-a9d5-2b6ed89a6c76/vintage-mid-century-modern-bentwood-bamboo-rattan-armchairs-set-of-4-1242', 'https://chairish-prod.freetls.fastly.net/image/product/sized/4f5e75be-feeb-4869-8436-454e6485afb8/vintage-mid-century-modern-bentwood-bamboo-rattan-armchairs-set-of-4-0548', 'https://chairish-prod.freetls.fastly.net/image/product/sized/b8620d45-5f75-4df5-9348-1f18455dc207/vintage-mid-century-modern-bentwood-bamboo-rattan-armchairs-set-of-4-1479', 'https://chairish-prod.freetls.fastly.net/image/product/sized/c2aed860-1244-4052-88a3-d344b1ec34f9/vintage-mid-century-modern-bentwood-bamboo-rattan-armchairs-set-of-4-8123', 'https://chairish-prod.freetls.fastly.net/image/product/sized/6106e926-e794-4fd6-a952-cd9d587fadfa/vintage-mid-century-modern-bentwood-bamboo-rattan-armchairs-set-of-4-8026', 'https://chairish-prod.freetls.fastly.net/image/product/sized/45556359-8ab7-4ad3-974c-6063f3071fa9/vintage-mid-century-modern-bentwood-bamboo-rattan-armchairs-set-of-4-0930', 'https://chairish-prod.freetls.fastly.net/image/product/sized/eb673093-efbd-4f82-92d0-1e571a133412/vintage-mid-century-modern-bentwood-bamboo-rattan-armchairs-set-of-4-3365']",Furniture,Seating,,28,35,25,"Colorado Springs, CO"
