title,sku,price,retail_price,category,sub_category,description,width,height,depth,tags,brand,designer,images
Danish Modern Draw Leaf Dining Table In Rosewood,7101126639748,3800.0,,tables,DINING TABLE,"Origin: Denmark. Designer: Unknown. Manufacturer: Unknown. Era: 1960s. Materials: Rosewood. Measurements: 49″ (closed), 98.5″ (open) wide x 34.75″ deep x 29″ tall Condition: In excellent original condition with typical wear for its vintage. Price includes restoration / refinishing.",98.5,29,34.75,"1960s, 2023, DA13090, DANISH MODERN, Denmark, depth:34.75, DINING TABLE, DRAW LEAF, height:29, June2023, May 2023, PRE ORDER, ROSEWOOD, table, width:49, width:98.5",,,"https://midcenturymobler.com/cdn/shop/products/DA13090.jpg?v=1681634277, https://midcenturymobler.com/cdn/shop/products/DA13090b.jpg?v=1681634277"
Set Of Johannes Andersen Y Legged Nesting Tables In Teak,7208252637316,1800.0,,tables,NESTING TABLES,"Origin: DenmarkDesigner: Johannes AndersenManufacturer: CFC SilkeborgEra: 1960sMaterials: TeakMeasurements: 28"" wide x 16"" deep x 20.5"" tall Condition: In excellent original condition with vintage wear. Price includes a full restoration / refinishing to remove all cosmetic wear.",28,20.5,16,"atomic, cfc, cfc silkeborg, danish modern, depth:16, height:20.5, JOHANNES ANDERSEN, nesting, teak, width:28",,,"https://midcenturymobler.com/cdn/shop/files/DSC_6855_8477ede0-71a4-454c-aad8-5e6c727538c4.jpg?v=1702623215, https://midcenturymobler.com/cdn/shop/files/DSC_6847_707d9299-3ed9-4d38-bd8b-2a581d29de46.jpg?v=1702623214, https://midcenturymobler.com/cdn/shop/files/DSC_6852_40a480ce-0931-4fce-b0de-f2f1c1bdc6bc.jpg?v=1702623215, https://midcenturymobler.com/cdn/shop/files/DSC_6859_f0a12790-e2bf-4682-9986-495d81ab8420.jpg?v=1702623214, https://midcenturymobler.com/cdn/shop/files/DSC_6862_9030cc32-e200-4fa1-94aa-93ef3608214f.jpg?v=1702623216, https://midcenturymobler.com/cdn/shop/files/DSC_6864_2e428252-1c5e-41a2-baff-c08080ecb16b.jpg?v=1702623214"
Danish Modern Three Legged Entry Chest In Teak + Oak,6710701064324,1675.0,,storage,Cabinets & Storage,Origin: Denmark. Designer: Unknown. Manufacturer: Unknown. Era: 1960s. Materials: Teak. Measurements: 39.75″ wide x 15.75″ deep x 27.5″ tall Condition: In excellent original condition with some light vintage wear,39.75,27.5,15.75,"atomic, chest, depth:15.75, dresser, height:27.5, teak, width:39.75",,,"https://midcenturymobler.com/cdn/shop/products/DA12078.jpg?v=1666729251, https://midcenturymobler.com/cdn/shop/products/DA12078b.jpg?v=1666729251, https://midcenturymobler.com/cdn/shop/products/DA12078c.jpg?v=1666729251"
Model 64 Writing Desk In Teak By Arne Wahl Iversen,7047942078596,4500.0,,tables,DESK,"Origin: DenmarkDesigner: Arne Wahl IversenManufacturer: Vinde MøbelfabrikEra: 1960sMaterials: TeakMeasurements: 39.5″ wide x 28″ deep x 29"" tall (to top of desk) 33″ tall (to top / back of desk) Condition: In excellent original condition with some patina. Price includes a full restoration / refinishing Lead time for restoration: 8 - 10 weeks",39.5,29,28,"ARNE WAHL, arne wahl iversen, depth:28, height:33, VINDE, Vinde Møbelfabrik, width:39.5",,,"https://midcenturymobler.com/cdn/shop/products/DSC_9019_51591db3-92e5-4cbb-9bdf-09c9dbee5afb.jpg?v=1673386774, https://midcenturymobler.com/cdn/shop/products/DSC_9022_b24610b4-0ee6-4b12-ad61-f9cb4a198674.jpg?v=1673386775, https://midcenturymobler.com/cdn/shop/products/DSC_9028_25aa7e87-420b-4aa2-a72c-70c6fc754be4.jpg?v=1673386775, https://midcenturymobler.com/cdn/shop/products/DSC_9034_89347689-929a-4cb3-8a90-e8e473bc4546.jpg?v=1673386773, https://midcenturymobler.com/cdn/shop/products/DSC_9052_d28de26f-ba97-4049-b18d-8ebbed3199cf.jpg?v=1673386772, https://midcenturymobler.com/cdn/shop/products/DSC_9058_8a3ce751-6ca6-4fd4-bdc7-3f3f0a10651d.jpg?v=1673386773, https://midcenturymobler.com/cdn/shop/products/DSC_9060_10cf04f5-2b6a-47f7-8641-26541ab71f6c.jpg?v=1673386772, https://midcenturymobler.com/cdn/shop/products/DSC_9062.jpg?v=1673386771, https://midcenturymobler.com/cdn/shop/products/DSC_9070_1b8ab7a7-d9f5-4098-bd15-c89a80d07f65.jpg?v=1673386776, https://midcenturymobler.com/cdn/shop/products/DSC_9073.jpg?v=1673386774"
Locking Danish Modern Credenza In Teak,7043782017156,3200.0,,storage,Cabinets & Storage,Origin: Denmark Designer: Unknown. Manufacturer: Unknown. Era: 1960s. Materials: Teak. Measurements: 67″ wide x 16″ deep x 31.5″ tall Condition: In excellent original condition with typical wear for its vintage. Price includes restoration / refinishing. Lead time for restoration: 8 - 10 weeks,67,31.5,16,"cane, credenza, oak, small, storage, width:67",,,"https://midcenturymobler.com/cdn/shop/products/DSC_8650_d1803325-92ac-466a-88e7-cd8193c71bf9.jpg?v=1672546461, https://midcenturymobler.com/cdn/shop/products/DSC_8670_870f0f20-288f-4c80-b5c2-feab5a8ca0de.jpg?v=1672546461, https://midcenturymobler.com/cdn/shop/products/DSC_8674.jpg?v=1672546461, https://midcenturymobler.com/cdn/shop/products/DSC_8682_be111305-ffbe-41a9-a85d-0036357aea74.jpg?v=1672546461, https://midcenturymobler.com/cdn/shop/products/DSC_8663_ec626c9f-87a9-4455-9975-5bfc82cbe68c.jpg?v=1672546461, https://midcenturymobler.com/cdn/shop/products/DSC_8675_6998decc-1087-43bc-ac37-29118b37fb48.jpg?v=1672546461"
1970S Enamel Pendant Lamp,6957937328260,950.0,,lighting,PENDANT LAMP,"Origin: Denmark. Designer: Unknown. Manufacturer: Unknown. Era: 1970s. Materials: Enameled Steel. Measurements: 14″ diameter x 10"" tall (shade) Condition: In excellent original condition.",14,10,,"1970s, 2023, DA12819, Denmark, ENAMEL, Enameled Steel, JANUARY 2023, lamp, pendant lamp, PRE-ORDER, width:14",,,"https://midcenturymobler.com/cdn/shop/products/DA12819.jpg?v=1662802093, https://midcenturymobler.com/cdn/shop/products/DA12819c.jpg?v=1662802099, https://midcenturymobler.com/cdn/shop/products/DA12819b.jpg?v=1662802099, https://midcenturymobler.com/cdn/shop/products/DA12819d.jpg?v=1662802099"
Erling Torvits Brazilian Rosewood Secretary Desk,7015308361860,4100.0,,storage,SECRETARY DESK,Origin: Denmark. Designer: Erling Torvits. Manufacturer: Klim Møbelfabrik. Era: 1960s. Materials: Rosewood. Measurements: 41″ wide x 18.75″ deep x 47.75″ tall Condition: In excellent original condition with light vintage wear. Price includes restoration.,41,47.75,18.75,"1960s, 2023, BRAZILIAN, DA12965, DANISH MODERN, DENMARK, depth:18.75, DESK, ERLING TORVITS, height:47.75, June2023, Klim Møbelfabrik, May 2023, PRE ORDER, ROSEWOOD, SECRETARY DESK, width:41",Klim Møbelfabrik,Erling Torvits,"https://midcenturymobler.com/cdn/shop/products/DA12965.jpg?v=1667966783, https://midcenturymobler.com/cdn/shop/products/DA12965b.jpg?v=1667966791, https://midcenturymobler.com/cdn/shop/products/DA12965c.jpg?v=1667966791, https://midcenturymobler.com/cdn/shop/products/DA12965d.jpg?v=1667966791"
Danish Modern Loveseat In Black Leather,6710697197700,2650.0,3200.0,seating,seating,Origin: Denmark. Designer: Unknown. Manufacturer: Unknown. Era: 1960s. Materials: Leather. Measurements: 62″ wide x 33.5″ deep x 30.25″ tall Condition: Leather in excellent original condition with light vintage wear / some patina.,62,30.25,33.5,"depth:33.5, dresser, height:30.25, rosewood, sale, width:62",,,"https://midcenturymobler.com/cdn/shop/products/1_9bfaff6f-b269-4c58-b9e1-f3883573fd00.jpg?v=1642629523, https://midcenturymobler.com/cdn/shop/products/4_f1c7229d-e1a6-49f6-a0e7-17d16f2345f9.jpg?v=1642629523, https://midcenturymobler.com/cdn/shop/products/3_54b5b43f-2c97-4fac-8d87-afc8bfc97274.jpg?v=1642629523, https://midcenturymobler.com/cdn/shop/products/2_f722e86a-20d4-448f-9732-5f26a1e836b1.jpg?v=1642629524"
Danish Modern Atomic Teak Highboy Dresser,6710650929284,2100.0,,storage,Cabinets & Storage,Origin: Denmark. Designer: Unknown. Manufacturer: Unknown. Era: 1960s. Materials: Teak. Measurements: 33.5″ wide x 17″ deep x 44.5″ tall Condition: In excellent original condition with some light vintage wear Restoration Includes:. • Refinish in oil or lacquer,33.5,44.5,17,"atomic, depth:17, dresser, height:44.5, oak, rosewood, teak, width:33.5",,,"https://midcenturymobler.com/cdn/shop/products/DA11883.jpg?v=1642625975, https://midcenturymobler.com/cdn/shop/products/DA11883b.jpg?v=1642625975, https://midcenturymobler.com/cdn/shop/products/DA11883c.jpg?v=1642625976"
Pair Of Ole Wanscher Lounge Chairs In Mahogany,6710083911812,4135.0,,seating,seating,"Origin: Denmark. Designer: Ole Wanscher. Manufacturer: Cado. Era: 1950s. Dimensions: 27″ wide x 26″ deep x 31″ tall. Seat: 21.5″ wide x 19″ deep x 15.5″ tall Restoration Includes:. • Structural + joint repair (if necessary) on all joints. • Refinish all wood surfaces in lacquer or oil. • New custom upholstery with fresh foam, straps and material (inquire for available fabrics)",27,31,26,"cado, chairs, depth:26, height :31, lounge, mahogany, ole, pair, wanscher, width:27",Cado,Ole Wanscher,"https://midcenturymobler.com/cdn/shop/products/ole.jpg?v=1642592250, https://midcenturymobler.com/cdn/shop/products/DSC_0169.jpg?v=1642592250, https://midcenturymobler.com/cdn/shop/products/DSC_0178.jpg?v=1642592250"
Pair Of Danish Modern Lounge Chairs In Wool + Leather,6710702112900,4600.0,,seating,seating,"Origin: Denmark. Designer: Unknown. Manufacturer: Unknown. Era: 1960s. Materials: Mahogany, Leather, Wool. Measurements: 28"" wide x 27"" deep x 30"" tall Seat Height: 16.5"" Condition: Frame in great original condition. Leather and wool is in fair condition with some fading Restoration Includes:. • Refinish frames in matte lacquer. • New custom upholstery with fresh foam and material Fabrics we recommend for upholstery:. Hallingdal. Tonus. Tonica. Clara. Divina MD",28,30,27,"chair, chairs, danish modern, lounge, pair",,,"https://midcenturymobler.com/cdn/shop/products/DA12034.jpg?v=1642630209, https://midcenturymobler.com/cdn/shop/products/DA12034b.jpg?v=1642630209, https://midcenturymobler.com/cdn/shop/products/download.png?v=1642630209"
Solid Afromosia Credenza By Richard Hornby,7206881493124,4675.0,,storage,CREDENZA,Origin: EnglandDesigner: Richard HornbyManufacturer: Fyn Layde FurnitureEra: 1966Materials: AfromosiaMeasurements: 75″ wide x 19.5″ deep x 32″ tallCondition: In excellent original condition with typical wear for its vintage.,75,32,19.5,"1966, afromosia, depth:19, england, ENGLAND - JANUARY 2024, Fyn Layde Furniture, height:32, PRE-ORDER, richard hornby, SOLID AFROMOSIA CREDENZA, width:75",,,"https://midcenturymobler.com/cdn/shop/files/DSC_8949.png?v=1709357556, https://midcenturymobler.com/cdn/shop/files/DSC_8961.png?v=1709357570, https://midcenturymobler.com/cdn/shop/files/DSC_8964.png?v=1709357570, https://midcenturymobler.com/cdn/shop/files/DSC_8970.png?v=1709357570, https://midcenturymobler.com/cdn/shop/files/DSC_8973.png?v=1709357570, https://midcenturymobler.com/cdn/shop/files/DSC_8981.png?v=1709357570, https://midcenturymobler.com/cdn/shop/files/DSC_8989.png?v=1709357570, https://midcenturymobler.com/cdn/shop/files/DSC_8992.png?v=1709357570"
Sold - Pair Of Glass + Brass Wall Lamps By Carl Fagerlund,6710683336836,2400.0,,lighting,lighting,"Origin: Sweden. Designer: Carl Fagerlund. Manufacturer: Orrefors, Lyfa. Era: 1950s. Materials: Glass, Brass. Dimensions: 15.75″ diameter Condition: In excellent original condition",,,,diameter:15.75,"Orrefors, Lyfa",Carl Fagerlund,"https://midcenturymobler.com/cdn/shop/products/CF2.jpg?v=1642627427, https://midcenturymobler.com/cdn/shop/products/CF1.jpg?v=1642627427"
Bow Edge Draw Leaf Dining Table In Rosewood,6764440125572,3100.0,,tables,Tables,"Origin: DenmarkDesigner: UnknownManufacturer: UnknownEra: 1960sMaterials: RosewoodMeasurements: 53″ (closed), 88.5″ (open) wide x 33.5″ deep x 29.5″ tall Condition: In excellent original condition with typical wear for its vintage.",88.5,29.5,33.5,"1960s, 2022, April 2022, BOW EDGE DRAW LEAF DINING TABLE, Denmark, depth:33.5, DINING TABLE, height:29.5, width:53, width:88.5",,,"https://midcenturymobler.com/cdn/shop/products/DA12641.jpg?v=1647415655, https://midcenturymobler.com/cdn/shop/products/DA12641a.jpg?v=1647415656, https://midcenturymobler.com/cdn/shop/products/DA12641b.jpg?v=1647415656, https://midcenturymobler.com/cdn/shop/products/DA12641c.jpg?v=1647415656"
Set Of G Plan Astro Nesting Tables In Teak #1,7206897385604,1100.0,,tables,NESTING TABLES,"Origin: EnglandDesigner: Victor B. WilkinsManufacturer: G PlanEra: 1966Materials: Teak, AfromosiaMeasurements: 19.5″ wide x 19.5″ deep x 20″ tallCondition: In excellent original condition with typical wear for its vintage. Price includes restoration / refinishing to remove all cosmetic wear.",19.5,20,19.5,"1966, afromosia, depth:19.5, england, ENGLAND - JANUARY 2024, g plan, height:20, nesting tables, PRE-ORDER, teak, Victor B. Wilkins, width:19.5",,,"https://midcenturymobler.com/cdn/shop/files/DSC_8374.png?v=1709265476, https://midcenturymobler.com/cdn/shop/files/DSC_8362.png?v=1709265476, https://midcenturymobler.com/cdn/shop/files/DSC_8364.png?v=1709265474, https://midcenturymobler.com/cdn/shop/files/DSC_8368.png?v=1709265474, https://midcenturymobler.com/cdn/shop/files/DSC_8371.png?v=1709265474, https://midcenturymobler.com/cdn/shop/files/DSC_8377.png?v=1709265472"
"Swedish Modern ""Prydno"" Freestanding Wall Unit In Teak",7079668154500,2750.0,,storage,WALL UNIT,"Origin: Sweden. Designer: Unknown. Manufacturer: Bröderna Gustafsson, Virserum. Era: 1960s. Materials: Teak. Measurements: 67.25″ wide x 27.5″ deep x 76.25″ tall Condition: In excellent original condition with typical wear for its vintage. Price includes restoration / refinishing.",67.25,76.25,27.5,"1960s, 2023, Bröderna Gustafsson, DA13038, DENMARK, depth:27.5, FREESTANDING, height:76.5, June2023, May 2023, PRYDNO, Sweden, SWEDISH MODERN, Teak, Virserum, WALL UNIT, width:67.25","Bröderna Gustafsson, Virserum",,"https://midcenturymobler.com/cdn/shop/products/DA13038.jpg?v=1678595046, https://midcenturymobler.com/cdn/shop/products/DA13038b.jpg?v=1678595052, https://midcenturymobler.com/cdn/shop/products/DA13038c.jpg?v=1678595052"
Space Age Ufo Table Lamp By Fog + Morup #4,6710760276100,1650.0,,lighting,lighting,"Origin: Denmark. Designer: Unknown. Manufacturer: Fog + Morup. Era: 1960s. Materials: Steel, Plastic. Measurements: 17.5″ diameter x 19″ tall Condition: In excellent original condition.",,19,,"1960s, AGE, denmark, diameter, diameter:17.5, fog, FOG + MORUP, height:19, lamp, model, modern, morup, October 2021, plastic, PRE-ORDER, SPACE, space age, SPACE AGE UFO TABLE LAMP, steel, table, table lamp, ufo",Fog + Morup,,https://midcenturymobler.com/cdn/shop/products/DA12206.jpg?v=1642636871
Gunni Omann Model 18 Credenza In Brazilian Rosewood #2,7218410619012,12000.0,,storage,CREDENZA,"Origin: DenmarkDesigner: Gunni OmannManufacturer: Omann Jun MøbelfabrikEra: 1960sMaterials: RosewoodMeasurements: 78.75"" wide x 18"" deep x 32.75"" tall Condition: In excellent original condition with typical wear for its vintage.",78.75,32.75,18,"denmark, DENMARK - JANUARY 2024, depth:18, gunni omann, height:32.75, MODEL 18 CREDENZA IN BRAZILIAN ROSEWOOD, Omann Jun Møbelfabrik, PRE-ORDER, rosewood, width:78.75",,,"https://midcenturymobler.com/cdn/shop/files/DA13239.jpg?v=1705400545, https://midcenturymobler.com/cdn/shop/files/DA13239b.jpg?v=1705400546, https://midcenturymobler.com/cdn/shop/files/DA13239c.jpg?v=1705400547"
Large Blue High Pile Rya Rug By Strehog Norden,7079722123396,2150.0,,accessories,RYA RUG,Origin: Sweden. Designer: Unknown. Manufacturer: Unknown. Era: 1960s. Materials: Wool. Measurements: 67″ wide x 92.5″ tall Condition: In excellent original condition with typical wear for its vintage.,67,92.5,,"1960s, 2023, BLUE HIGH PILE, DA13058, DENMARK, height:92.5, June2023, LARGE, May 2023, RUG, RYA, RYA RUG, STREHOG NORDEN, Sweden, width:67, Wool",,,"https://midcenturymobler.com/cdn/shop/products/DA13058.jpg?v=1678606334, https://midcenturymobler.com/cdn/shop/products/DA13058c.jpg?v=1678606345, https://midcenturymobler.com/cdn/shop/products/DA13058b.jpg?v=1678606344, https://midcenturymobler.com/cdn/shop/products/DA13058e.jpg?v=1678606344, https://midcenturymobler.com/cdn/shop/products/DA13058f.jpg?v=1678606345, https://midcenturymobler.com/cdn/shop/products/DA13058d.jpg?v=1678606345"
Pair Of Swedish Teak And Beech Nightstands,7245942751364,2250.0,,storage,,"Origin: SwedenDesigner: UnknownManufacturer: UnknownEra: 1960sMaterials: Teak, BeechMeasurements: 18.5″ wide x 13″ deep x 20.5″ tall Condition: In excellent original condition with some light vintage wear. Price includes a full restoration / refinish to remove all cosmetic wear",18.5,20.5,13,"beech, depth:13, height:20.5, modern, nightstands, swedish, tables, teak, width:18.5",,,"https://midcenturymobler.com/cdn/shop/files/DSC_0880.jpg?v=1711567454, https://midcenturymobler.com/cdn/shop/files/DSC_0873.jpg?v=1711567452, https://midcenturymobler.com/cdn/shop/files/DSC_0875.jpg?v=1711567453, https://midcenturymobler.com/cdn/shop/files/DSC_0882.jpg?v=1711567454, https://midcenturymobler.com/cdn/shop/files/DSC_0884.jpg?v=1711567452"
Pair Of Freestanding Teak Speakers By Phillips,6710709321860,925.0,,accessories,accessories,Origin: Denmark. Designer: Unknown. Manufacturer: Phillips. Era: 1960s. Materials: Teak. Measurements: 28″ tall Condition: In excellent original condition. Not function tested.,,28,,"1960s, denmark, freestanding, height:28, pair, PHILLIPS, SPEAKERS, teak",Phillips,,"https://midcenturymobler.com/cdn/shop/products/DA12173.jpg?v=1642631430, https://midcenturymobler.com/cdn/shop/products/DA12173b.jpg?v=1642631430, https://midcenturymobler.com/cdn/shop/products/DA12173c.jpg?v=1642631431"
Danish Modern Bow Front Secretary Desk In Teak,7245940621444,2400.0,,storage,,"Origin: DenmarkDesigner: UnknownManufacturer: UnknownEra: 1960sMaterials: TeakMeasurements: 33.25"" wide x 16"" deep x 42.5"" tall, Desk: 21.5"" wide, 16.75"" deep x 28"" tall Condition: In excellent original condition.",33.25,42.5,16,"bow, bow front, curved, danish, danish modern, denmark, depth:16, height:42.5, secretary, teak, width:33.25",,,"https://midcenturymobler.com/cdn/shop/files/DSC_9889.jpg?v=1711566923, https://midcenturymobler.com/cdn/shop/files/DSC_9884.jpg?v=1711566919, https://midcenturymobler.com/cdn/shop/files/DSC_9892.jpg?v=1711566921, https://midcenturymobler.com/cdn/shop/files/DSC_9894.jpg?v=1711566919, https://midcenturymobler.com/cdn/shop/files/DSC_9896.jpg?v=1711566920, https://midcenturymobler.com/cdn/shop/files/DSC_9900.jpg?v=1711566920, https://midcenturymobler.com/cdn/shop/files/DSC_9903.jpg?v=1711566921, https://midcenturymobler.com/cdn/shop/files/DSC_9910.jpg?v=1711566922"
Swedish Modern Inlay Record Cabinet In Maple Burl,7244354977924,1650.0,,storage,,Origin: SwedenDesigner: UnknownManufacturer: UnknownEra: 1940sMaterials: MapleMeasurements: 31.5″ wide x 16″ deep x 24.5″ tall Condition: In excellent original condition with typical wear for its vintage. Price includes refinishing / restoration to remove all cosmetic wear.,31.5,24.5,16,"burl, cowboy, depth:16, height:24.5, inlay, record, stereo, storage, swedish, width:41.5",,,"https://midcenturymobler.com/cdn/shop/files/DSC_9745.jpg?v=1711079403, https://midcenturymobler.com/cdn/shop/files/DSC_9747.jpg?v=1711079406, https://midcenturymobler.com/cdn/shop/files/DSC_9752.jpg?v=1711079405, https://midcenturymobler.com/cdn/shop/files/DSC_9756.jpg?v=1711079407, https://midcenturymobler.com/cdn/shop/files/DSC_9760.jpg?v=1711079404, https://midcenturymobler.com/cdn/shop/files/DSC_9772.jpg?v=1711079404"
Danish Modern Atomic Teak Flip Top Vanity,6710661152900,1950.0,,storage,Tables,Origin: Denmark. Designer: Unknown. Manufacturer: Unknown. Era: 1960s. Materials: Teak. Measurements: 26.5″ wide x 14.75″ deep x 36.25″ tall. Condition: In excellent original condition with some light vintage wear,26.5,36.25,14.75,"depth:14.75, dresser, height:36.25, secretary, teak, vanity, width:26.5",,,"https://midcenturymobler.com/cdn/shop/products/DA11931.jpg?v=1642626317, https://midcenturymobler.com/cdn/shop/products/DA11931b.jpg?v=1642626317, https://midcenturymobler.com/cdn/shop/products/DA11931c.jpg?v=1642626317, https://midcenturymobler.com/cdn/shop/products/DA11931d.jpg?v=1642626317"
"1950S ""Hansa"" Modular Bookcase In Teak",7218133172356,1725.0,,storage,BOOKCASE,"Origin: SwedenDesigner: Gillis LundgrenManufacturer: IKEAEra: 1950sMaterials: Teak, MetalMeasurements: 35.5″ wide x 10″ deep x 43.5″ tall Condition: In excellent original condition with typical wear for its vintage.",35.5,43.5,10,"1950s, BOOKCASE IN TEAK, DENMARK - JANUARY 2024, depth:10, Gillis Lundgren, height:43.5, ikea, metal, PRE-ORDER, PRE1950s ""HANSA"" MODULAR BOOKCASE IN TEAK-ORDER, sweden, teak, width:35.5",,,"https://midcenturymobler.com/cdn/shop/files/DA13214.jpg?v=1705308882, https://midcenturymobler.com/cdn/shop/files/DA13214b.jpg?v=1705308882, https://midcenturymobler.com/cdn/shop/files/DA13214c.jpg?v=1705308881, https://midcenturymobler.com/cdn/shop/files/DA13214d.jpg?v=1705308882"
Danish Modern Atomic Teak + Oak Desk #2,6710766731396,6100.0,7200.0,tables,Desks,"Origin: Denmark. Designer: Unknown. Manufacturer: Unknown. Era: 1950s. Materials: Teak, Oak. Measurements: 43.5″ wide x 20.5″ deep x 36.25″ tall Condition: In excellent original condition with some vintage wear. Price includes restoration.",43.5,36.25,20.5,"1950s, DANISH MODERN ATOMIC DESK, denmark, depth:20.5, desk, england, height:36.25, oak, sale, teak, width:43.5",,,"https://midcenturymobler.com/cdn/shop/products/NW50225.jpg?v=1642637696, https://midcenturymobler.com/cdn/shop/products/NW50225d.jpg?v=1642637696, https://midcenturymobler.com/cdn/shop/products/NW50225e.jpg?v=1642637696, https://midcenturymobler.com/cdn/shop/products/NW50225b.jpg?v=1642637696, https://midcenturymobler.com/cdn/shop/products/NW50225c.jpg?v=1642637696"
Large Four Seat Sofa In Walnut By Metropolitan,7234645033092,4800.0,,seating,,"Origin: USA. Designer: Unknown. Manufacturer: Metropolitan Furniture Company. Era: 1960s. Materials: Walnut, Wool. Measurements: 97″ wide x 32″ deep x 28″ tall, Seat: 15.5"" tall, Arm: 20.5"" tall Condition: Frame in excellent original condition. Price includes restoration + new upholstery in your choice of material. Restoration Includes:. • Refinish legs. • New custom upholstery with fresh foam and material Fabrics we recommend for upholstery:. Hallingdal. Tonus. Tonica. Clara. Divina MD",97,28,32,"depth:32, height:28, large sofa, metropolitan, orange, san francisco, sofa, usa, walnut, width:97",Metropolitan Furniture Company,,"https://midcenturymobler.com/cdn/shop/files/DSC_9329.png?v=1709360942, https://midcenturymobler.com/cdn/shop/files/DSC_9321.png?v=1709360941, https://midcenturymobler.com/cdn/shop/files/DSC_9332.png?v=1709360940, https://midcenturymobler.com/cdn/shop/files/DSC_9336_ac223d17-e05e-4836-b3fc-7d2c5cb19b76.jpg?v=1709360944, https://midcenturymobler.com/cdn/shop/files/DSC_9342.png?v=1709360939, https://midcenturymobler.com/cdn/shop/files/DSC_9343.png?v=1709360943, https://midcenturymobler.com/cdn/shop/files/DSC_9348.png?v=1709360942, https://midcenturymobler.com/cdn/shop/files/DSC_9352.png?v=1709360944, https://midcenturymobler.com/cdn/shop/files/DSC_9355.png?v=1709360940, https://midcenturymobler.com/cdn/shop/files/DSC_9358.png?v=1709360943, https://midcenturymobler.com/cdn/shop/files/DSC_9360.png?v=1709360939"
Pair Of Danish Modern Lounge Chairs With Rosewood Paws,6710715842692,5400.0,,seating,seating,"Origin: Denmark. Designer: Unknown. Manufacturer: Unknown. Era: 1950s. Materials: Rosewood, Wool. Measurements: 27.5″ wide x 26″ deep x 31.5″ tall Condition: In excellent original condition. Wool has light vintage wear.",27.5,31.5,26,"1950s, chairs, DANISH MODERN LOUNGE CHAIRS, denmark, depth:26, height:31.5, lounge, lounge chairs, model, modern, pair, PAWS, rosewood, ROSEWOOD PAWS, width:27.5, wool",,,"https://midcenturymobler.com/cdn/shop/products/DA12215.jpg?v=1642632136, https://midcenturymobler.com/cdn/shop/products/DA12215c.jpg?v=1642632136, https://midcenturymobler.com/cdn/shop/products/DA12215b.jpg?v=1642632136"
Small Danish Modern Vanity In Teak,7125645656196,950.0,,storage,SECRETARY DESKS,"Origin: Denmark. Designer: Unknown. Manufacturer: Unknown. Era: 1950s. Materials: Teak. Measurements: 26.5"" wide x 14.25"" deep x 26.25"" tall Condition: In good original condition with vintage wear. Price includes refinishing / restoration.",26.5,26.25,14.25,"1950s, 2023, DA12086, DANISH MODERN, Denmark, depth:14, height:26.5, June2023, NEW SHIPMENT - JUNE 2023, SECRETARY DESKS, small, SMALL VANITY, STORAGE, TEAK, VANITIES, VANITIES / SECRETARY DESKS, vanity, width:26",,,"https://midcenturymobler.com/cdn/shop/files/DA12086.jpg?v=1688276410, https://midcenturymobler.com/cdn/shop/files/DA12086c.jpg?v=1688276416, https://midcenturymobler.com/cdn/shop/files/DA12086d.jpg?v=1688276415, https://midcenturymobler.com/cdn/shop/files/DA12086b.jpg?v=1688276415"
Teak Boomerang Desk By Goran Strand,6710738157700,4500.0,,tables,Desks,Origin: Sweden. Designer: Göran Strand. Manufacturer: Bengtsfors. Era: 1950s. Materials: Teak. Measurements: 53.5″ wide x 32″ deep x 28.5″ tall Condition: In excellent original condition.,53.5,28.5,32,"1950s, 2022, Bengtsfors, boomerang, BOOMERANG DESK, denmark, depth:32, desk, Göran Strand, height:28.5, sweden, teak, width:53.5",Bengtsfors,Göran Strand,"https://midcenturymobler.com/cdn/shop/products/DA12374.jpg?v=1642634575, https://midcenturymobler.com/cdn/shop/products/DA12374e.jpg?v=1642634575, https://midcenturymobler.com/cdn/shop/products/DA12374d.jpg?v=1642634575, https://midcenturymobler.com/cdn/shop/products/DA12374f.jpg?v=1642634575, https://midcenturymobler.com/cdn/shop/products/DA12374g.jpg?v=1642634576, https://midcenturymobler.com/cdn/shop/products/DA12374c.jpg?v=1642634576, https://midcenturymobler.com/cdn/shop/products/DA12374b.jpg?v=1642634576"
