title,sku,price,retail_price,category,sub_category,description,width,height,depth,tags,brand,designer,images
Set Of Four Ps142 Lounge Chairs By Eugenio Gerli For Tecno,7031991599236,7200.0,,seating,LOUNGE CHAIRS,"Origin: Italy. Designer: Eugenio Gerli. Manufacturer: Tecno. Era: 1960s. Materials: Wool, Metal. Measurements: 26.5″ wide x 19.75″ deep x 26.25″ tall Condition: In good original condition with vintage wear. Price includes new upholstery in your choice of fabric.",26.5,26.25,19.75,"2023, CHAIRS, DA12998, DANISH MODERN, DENMARK, depth:19.75, EUGENIO GERLI, height:26.25, Italy, JANUARY 2023, LOUNGE, LOUNGE CHAIRS, Metal, PS142, SET OF FOUR, TECNO, width:26.5, Wool",Tecno,Eugenio Gerli,"https://midcenturymobler.com/cdn/shop/products/DA12998.jpg?v=1670310059, https://midcenturymobler.com/cdn/shop/products/DA12998b.jpg?v=1670310067, https://midcenturymobler.com/cdn/shop/products/DA12998c.jpg?v=1670310066, https://midcenturymobler.com/cdn/shop/products/DA12998d.jpg?v=1670310067, https://midcenturymobler.com/cdn/shop/products/DA12998e.jpg?v=1670310067"
Siesta Lounge Chair + Ottoman In Beige Leather By Ingmar Relling,6957914292356,2500.0,,seating,LOUNGE CHAIR,"Origin: Norway. Designer: Ingmar Relling. Manufacturer: Westnofa. Era: 1970s. Materials: Stained Beech, Leather. Measurements: 28.25″ wide x 32"" deep x 39″ tall (Chair), 25"" wide x 20"" deep x 19"" tall (Ottoman) Condition: In excellent original condition with typical wear for its vintage.",28.25,39,32,"1970s, 2023, BEIGE LEATHER, CHAIR, DA12815, Denmark- October 2023, height:35, Ingmar Relling, Leather, LOUNGE CHAIR, Norway, ottoman, PRE-ORDER, SIESTA, Stained Beech, Westnofa, width:28.25",Westnofa,Ingmar Relling,"https://midcenturymobler.com/cdn/shop/products/DA12815.jpg?v=1662800642, https://midcenturymobler.com/cdn/shop/products/DA12815e.jpg?v=1662800658, https://midcenturymobler.com/cdn/shop/products/DA12815i.jpg?v=1662800659, https://midcenturymobler.com/cdn/shop/products/DA12815j.jpg?v=1662800658, https://midcenturymobler.com/cdn/shop/products/DA12815g.jpg?v=1662800660, https://midcenturymobler.com/cdn/shop/products/DA12815f.jpg?v=1662800658, https://midcenturymobler.com/cdn/shop/products/DA12815d.jpg?v=1662800660, https://midcenturymobler.com/cdn/shop/products/DA12815b.jpg?v=1662800658, https://midcenturymobler.com/cdn/shop/products/DA12815c.jpg?v=1662800659, https://midcenturymobler.com/cdn/shop/products/DA12815h.jpg?v=1662800657"
Nanna Ditzel Highback Lounge Chair In Purple Wool,6710090104964,3700.0,,seating,seating,"Origin: Denmark. Designer: Nanna Ditzel. Manufacturer: Søren Willadsen Møbelfabrik. Era: 1950s. Dimensions: 31.5″ wide x 27.5″ deep x 39.5″ tall. Seat: 22″ wide x 20″ deep x 15″ tall. Condition: Frame in excellent original condition. Fabric in good original condition with minor losses. Restoration Includes:. • Structural + joint repair (if necessary) on all joints. • Refinish all wood surfaces in lacquer or oil. • New custom upholstery with fresh foam, straps and material (inquire for available fabrics)",31.5,39.5,27.5,"depth:27.5, ditzel, height :39.5, highback, nanna, teak, width:31.5",Søren Willadsen Møbelfabrik,Nanna Ditzel,"https://midcenturymobler.com/cdn/shop/products/nanna-1.jpg?v=1642592619, https://midcenturymobler.com/cdn/shop/products/DSC_0523-1.jpg?v=1642592619, https://midcenturymobler.com/cdn/shop/products/DSC_0528-1.jpg?v=1642592619, https://midcenturymobler.com/cdn/shop/products/DSC_0531-1.jpg?v=1642592619"
Teak + Cane Loveseat / Daybed By Peter Hvidt,7198403952772,3650.0,,seating,LOVESEAT,Origin: DenmarkDesigner: Peter HvidtManufacturer: France + SonEra: 1950sDimensions: 63″ wide x 29.5″ deep x 30″ tallSeat: 17″ tallCondition: Frame in excellent original condition. Fabric in good original condition with some fading.,63,30,29.5,"cane, daybed, depth:29.5, france and son, height:30, hvidt, loveseat, peter hvidt, teak, width:63",,,"https://midcenturymobler.com/cdn/shop/files/DSC_6248_c2029f83-be0a-437e-ae03-2b4aeb7157af.jpg?v=1699383877, https://midcenturymobler.com/cdn/shop/files/DSC_6244.jpg?v=1699383878, https://midcenturymobler.com/cdn/shop/files/DSC_6253_b0c9e80a-5c54-4579-a620-d4ece465c56a.jpg?v=1699383879, https://midcenturymobler.com/cdn/shop/files/DSC_6256_e01825c1-6404-44f6-8ee5-62d85dc323a2.jpg?v=1699383880, https://midcenturymobler.com/cdn/shop/files/DSC_6260_7232c6c5-9487-4342-ac19-b52b9738905d.jpg?v=1699383878, https://midcenturymobler.com/cdn/shop/files/DSC_6262_189b1f74-512f-441a-8d92-8bda5feef4fd.jpg?v=1699383876, https://midcenturymobler.com/cdn/shop/files/DSC_6267_40a18902-a372-4999-82f7-943ce2c0650d.jpg?v=1699383881, https://midcenturymobler.com/cdn/shop/files/DSC_6269_23e95a11-bd68-4291-86e1-d26c034881d8.jpg?v=1699383877, https://midcenturymobler.com/cdn/shop/files/DSC_6271_7efac808-6d3e-4a3e-8599-b0f62e085c35.jpg?v=1699383876, https://midcenturymobler.com/cdn/shop/files/DSC_6276_7a5aedf9-b234-4b96-9a2d-d3d869abdd1a.jpg?v=1699383876, https://midcenturymobler.com/cdn/shop/files/DSC_6278_4ccfaecb-fb72-484a-81b3-dacbd425f945.jpg?v=1699383879"
Danish Modern Sliding Door Teak Credenza With Keeler Edge,7112787787908,5800.0,,storage,CREDENZA,"Origin: Denmark. Designer: Unknown. Manufacturer: Unknown. Era: 1960s. Materials: Teak. Measurements: 79"" wide x 17.5"" deep x 34"" tall Condition: In excellent original condition with typical wear for its vintage. Price includes restoration / refinishing.",79,34,17.5,"1960s, 2023, August, CREDENZA, DANISH MODERN, depth:17.5, England, height:34, KEELER EDGE, NW50338, SLIDING DOOR, TEAK, width:79",,,"https://midcenturymobler.com/cdn/shop/files/DSC_4000_4daf859d-bfbc-4919-967f-43029d7c6dad.jpg?v=1692556737, https://midcenturymobler.com/cdn/shop/files/DSC_4004_7d0b9f0e-a745-4c54-b5dd-3f25177e573d.jpg?v=1692556748, https://midcenturymobler.com/cdn/shop/files/DSC_4006_074db6fa-feba-42ed-b02e-ba1eeadf8103.jpg?v=1692556748, https://midcenturymobler.com/cdn/shop/files/DSC_4013.jpg?v=1692556748, https://midcenturymobler.com/cdn/shop/files/DSC_4018_6246d073-9904-416e-8620-25b9f6a5289a.jpg?v=1692556748, https://midcenturymobler.com/cdn/shop/files/DSC_4025_681cf84b-a821-4f7b-9d7e-c3e4b1c44eef.jpg?v=1692556748, https://midcenturymobler.com/cdn/shop/files/DSC_4028_3a17d508-ea70-4030-b4b3-70be3fb52ba2.jpg?v=1692556748, https://midcenturymobler.com/cdn/shop/files/DSC_4031_3fa88828-6ba5-4de3-b67d-d285db00640e.jpg?v=1692556748, https://midcenturymobler.com/cdn/shop/files/DSC_4034_0e2b7734-e978-4fe3-967c-b404ff3d4273.jpg?v=1692556748, https://midcenturymobler.com/cdn/shop/files/DSC_4037_0a2b3ac4-9129-41f3-a1cc-b23eae52ebf1.jpg?v=1692556748"
"Small Teak ""Varie"" Writing Desk By Arne Wahl Iversen",6980997677188,1725.0,,tables,WRITING DESK,Origin: Denmark. Designer: Arne Wahl Iversen. Manufacturer: IKEA. Era: 1960s. Materials: Teak. Measurements: 39.5″ wide x 17.75″ deep x 29.5″ tall Condition: In excellent original condition with light vintage wear. Price includes restoration.,39.5,29.5,17.75,"1960s, 2023, Arne Wahl Iversen, DA12887, DANISH MODERN, Denmark, depth:17.75, DESK, height:29.5, IKEA, JANUARY 2023, SMALL, Teak, VARIE, width:39.5, WRITING DESK",IKEA,Arne Wahl Iversen,"https://midcenturymobler.com/cdn/shop/products/DA12887.jpg?v=1665295905, https://midcenturymobler.com/cdn/shop/products/DA12887d.jpg?v=1665295912, https://midcenturymobler.com/cdn/shop/products/DA12887e.jpg?v=1665295913, https://midcenturymobler.com/cdn/shop/products/DA12887f.jpg?v=1665295914, https://midcenturymobler.com/cdn/shop/products/DA12887b.jpg?v=1665295914, https://midcenturymobler.com/cdn/shop/products/DA12887c.jpg?v=1665295913"
Large Danish Range Credenza By Ib Kofod Larsen,7112798765188,5750.0,,storage,CREDENZA,"Origin: Denmark. Designer: Ib Kofod Larsen. Manufacturer: G Plan. Era: 1961. Materials: Teak, Afromosia. Measurements: 92.5″ wide x 19.5″ deep x 30″ tall Condition: In excellent original condition with typical wear for its vintage. Price includes a full restoration / refinish to remove all cosmetic wear.",92.5,30,19.5,"1960s, 2023, Afromosia, August, CREDENZA, DANISH RANGE, depth:19.5, England, G Plan, height:30, IB KOFOD LARSEN, LARGE, NW50347, PRE ORDER, TEAK, width:92.5",G Plan,Ib Kofod Larsen,"https://midcenturymobler.com/cdn/shop/files/DSC_3134_07448691-e0ad-43eb-9174-13276e6ae153.jpg?v=1692077639, https://midcenturymobler.com/cdn/shop/files/DSC_3143_19169f2a-258d-477b-812c-be140435ad86.jpg?v=1692077639, https://midcenturymobler.com/cdn/shop/files/DSC_3145_cfa96779-dca3-4b70-b670-0497c77e8986.jpg?v=1692077639, https://midcenturymobler.com/cdn/shop/files/DSC_3148_47db6819-6d87-4cc0-a3fb-fc78bdfd13d0.jpg?v=1692077639, https://midcenturymobler.com/cdn/shop/files/DSC_3154_c71ff8de-8539-4414-abab-a58161186592.jpg?v=1692077639, https://midcenturymobler.com/cdn/shop/files/DSC_3158_52b67bf8-d3f7-40ea-a136-b7e9b550003e.jpg?v=1692077639, https://midcenturymobler.com/cdn/shop/files/DSC_3125_c1d68231-d03d-494d-9c42-b44265cde449.jpg?v=1692077639, https://midcenturymobler.com/cdn/shop/files/DSC_3163.jpg?v=1692077639, https://midcenturymobler.com/cdn/shop/files/DSC_3186_6bb37e2b-0bfb-405e-9380-ee54dfbbaf8f.jpg?v=1692077639"
"Illum Wikkelsø ""Capella"" Loveseat In Rosewood + Black Leather",7013380554884,3500.0,,seating,LOVESEAT,"Origin: Denmark. Designer: Illum Wikkelsø. Manufacturer: Neils Eilsersen. Era: 1960s. Materials: Rosewood, Leather. Measurements: 51″ wide x 27.5″ deep x 28.5″ tall Condition: In excellent original condition.",51,28.5,27.5,"1960s, 2023, BLACK LEATHER, capella, DA12902, DENMARK, depth:27.5, height:28.5, ILLUM WIKKELSØ, June2023, Leather, LOVESEAT, May 2023, Neils Eilsersen, PRE ORDER, Rosewood, width:51",Neils Eilsersen,Illum Wikkelsø,"https://midcenturymobler.com/cdn/shop/products/DA12902.jpg?v=1667641877, https://midcenturymobler.com/cdn/shop/products/DA12902b.jpg?v=1667641883, https://midcenturymobler.com/cdn/shop/products/DA12902c.jpg?v=1667641884, https://midcenturymobler.com/cdn/shop/products/DA12902d.jpg?v=1667641883"
Pair Of Atomic Teak + Oak Swedish Modern Nightstands,6919275118724,2850.0,,storage,SMALL CHESTS,"Origin: Sweden. Designer: Unknown. Manufacturer: AB NybrofabrikenEra: 1960sMaterials: Teak, OakMeasurements: 25"" wide x 12"" deep x 22.5"" tallCondition: In good original condition. Price includes refinishing / restoration.Lead time for restoration: 8 - 10 weeks.",25,22.5,12,"1960s, DA12688, depth:12, HALL CHEST, height:22, Oak, storage, Sweden, Teak, width:25","AB NybrofabrikenEra: 1960sMaterials: Teak, OakMeasurements: 25"" wide x 12"" deep x 22.5"" tallCondition: In good original condition. Price includes refinishing / restoration.Lead time for restoration: 8 - 10 weeks",,"https://midcenturymobler.com/cdn/shop/products/DSC_7979.jpg?v=1672253777, https://midcenturymobler.com/cdn/shop/products/DSC_7972.jpg?v=1672253871, https://midcenturymobler.com/cdn/shop/products/DSC_7975_430fa7dc-1018-4a60-a0f6-e5a09ee2f174.jpg?v=1672253871, https://midcenturymobler.com/cdn/shop/products/DSC_7982_66af49f8-1a56-49f6-8348-9eab2540ae2f.jpg?v=1672253871, https://midcenturymobler.com/cdn/shop/products/DSC_7984.jpg?v=1672253871, https://midcenturymobler.com/cdn/shop/products/DSC_7986.jpg?v=1672253871, https://midcenturymobler.com/cdn/shop/products/DSC_7992_9b4fd101-c09d-487f-9b7c-8f928ce9e119.jpg?v=1672253871, https://midcenturymobler.com/cdn/shop/products/DSC_7996_251d27fe-af68-49ed-9bb0-b957c6974f0b.jpg?v=1672253871, https://midcenturymobler.com/cdn/shop/products/DSC_8000_95430c51-3d63-4bf5-af9e-a6eb2b052d93.jpg?v=1672253871"
Fritz Hansen Lounge Chair With Rosewood Paws,6710712664196,2750.0,,seating,Cabinets & Storage,"Origin: Denmark. Designer: Unknown. Manufacturer: Fritz Hansen. Era: 1950s. Materials: Teak, Wool. Measurements: 28.25″ wide x 27"" deep x 32.25″ tall Condition: Frames in excellent condition. Wool has vintage wear. Price includes new upholstery in your choice of fabric.",28.25,32.25,27,"chair, denmark, fritz, fritz hansen, FRITZ HANSEN LOUNGE CHAIR, hansen, height:32.25, lounge, lounge chair, teak, TEAK PAWS, width:28.25, wool",Fritz Hansen,,"https://midcenturymobler.com/cdn/shop/products/DA12184.jpg?v=1642631833, https://midcenturymobler.com/cdn/shop/products/DA12184b.jpg?v=1642631833, https://midcenturymobler.com/cdn/shop/products/DA12184c.jpg?v=1642631833"
Danish Modern Flip Top Coffee Table / Bar,7189891874948,2150.0,,storage,COFFEE TABLE,Origin: DenmarkDesigner: UnknownManufacturer: UnknownEra: 1960sMaterials: TeakMeasurements: 22″ wide x 39.5″ deep x 14.75″ tall Condition: In excellent original condition with typical wear for its vintage.,22,14.75,39.5,"1960s, bar, coffee table, denmark, DENMARK - JANUARY 2024, depth:39.5, height:14.75, teak, width:22",,,"https://midcenturymobler.com/cdn/shop/files/DA13162b.jpg?v=1698141958, https://midcenturymobler.com/cdn/shop/files/DA13162c.jpg?v=1698141959, https://midcenturymobler.com/cdn/shop/files/DA13162e.jpg?v=1698141958, https://midcenturymobler.com/cdn/shop/files/DA13162f.jpg?v=1698141957, https://midcenturymobler.com/cdn/shop/files/DA13162g.jpg?v=1698141959"
Mahogany Cocktail Bar By Robert Heritage,7112973385860,3735.0,4150.0,storage,COCKTAIL BAR,"Origin: England. Designer: Robert Heritage. Manufacturer: Archie Shine. Era: 1958. Materials: Mahogany. Measurements: 34.5"" wide x 18"" deep x 45.5"" tall Condition: In excellent original condition with typical wear for its vintage. Price includes restoration / refinishing.",34.5,45.5,18,"1958, 1960s, 2023, Archie Shine, August, BAR, COCKTAIL, COCKTAIL BAR, Denmark, depth:18, England, height:45.5, NW50393, ROBERT HERITAGE, ROSEWOOD, sale, width:34.5",Archie Shine,Robert Heritage,"https://midcenturymobler.com/cdn/shop/files/DSC_2969.jpg?v=1698130056, https://midcenturymobler.com/cdn/shop/files/DSC_2947_4134d043-3b47-4155-9f6f-06ea0328dfe8.jpg?v=1698130056, https://midcenturymobler.com/cdn/shop/files/DSC_2943_a170675c-58bb-4e34-b19f-8bf8aeba88ff.jpg?v=1698130056, https://midcenturymobler.com/cdn/shop/files/DSC_2927_a35ba4dc-f666-4e3b-b5cb-54bc69b30d1f.jpg?v=1692062707, https://midcenturymobler.com/cdn/shop/files/DSC_2935.jpg?v=1692062707, https://midcenturymobler.com/cdn/shop/files/DSC_2941_b902a029-9b17-4917-94bb-9c1be97225fd.jpg?v=1692062707, https://midcenturymobler.com/cdn/shop/files/DSC_2951_e94b1cee-d556-479b-8a3d-4a98d67d57b3.jpg?v=1692062707, https://midcenturymobler.com/cdn/shop/files/DSC_2959_8c4014a5-087e-41b2-b546-c18340299a7a.jpg?v=1692062707, https://midcenturymobler.com/cdn/shop/files/DSC_2963.jpg?v=1692062707, https://midcenturymobler.com/cdn/shop/files/DSC_2974_e12efe29-83d9-4823-a57c-c119e0c99f4b.jpg?v=1692062707, https://midcenturymobler.com/cdn/shop/files/DSC_2975_b044f897-f8f8-4e20-b38a-87876c08d63e.jpg?v=1692062707, https://midcenturymobler.com/cdn/shop/files/DSC_2981.jpg?v=1692062707, https://midcenturymobler.com/cdn/shop/files/DSC_2986_73b8bee2-60f6-43b5-adb1-1d0868fa3138.jpg?v=1692062707"
Danish Modern Coffee Table With Small Foldable Side Table,7125645262980,2650.0,,tables,Coffee Tables,"Origin: Denmark. Designer: Unknown. Manufacturer: Trioh. Era: 1960s. Materials: Teak. Measurements: 62"" wide x 23"" deep x 21"" tall Condition: In good original condition with vintage wear. Price includes refinishing / restoration.",62,21,23,"1960s, 2023, COFFEE, COFFEE TABLE, DA12003, DANISH MODERN, Denmark, June2023, NEW SHIPMENT - JUNE 2023, SIDE TABLE, SMALL FOLDABLE, TABLES, TEAK, Trioh",Trioh,,"https://midcenturymobler.com/cdn/shop/files/DA12003.jpg?v=1688274758, https://midcenturymobler.com/cdn/shop/files/DA12003b.jpg?v=1688274762"
Square Pull Teak Credenza By H.W. Klein #4,6855638679684,5675.0,,storage,Cabinets & Storage,Origin: Denmark. Designer: H.W. Klein. Manufacturer: Bramin. Era: 1960s. Materials: Teak. Measurements: 88.5″ wide x 18″ deep x 31″ tall Condition: In excellent original condition with typical wear for its vintage. Price includes restoration.,88.5,31,18,"1960s, bramin, credenza, denmark, depth:18, england, h.w. klein, height:31, SQUARE PULL CREDENZA, width:88.5",Bramin,H.W. Klein,"https://midcenturymobler.com/cdn/shop/products/DSC_5377_9a80048a-c770-4cf4-ae7d-9f519c5d4844.jpg?v=1654392174, https://midcenturymobler.com/cdn/shop/products/DSC_5378_0ebb0939-3909-439b-91f3-9bab1cf98185.jpg?v=1654392173, https://midcenturymobler.com/cdn/shop/products/DSC_5381_80ca1c1f-a720-42a9-aa55-8d951938d59f.jpg?v=1654392174, https://midcenturymobler.com/cdn/shop/products/DSC_5386_121f501f-72aa-4d5a-988e-be124b51c993.jpg?v=1654392173, https://midcenturymobler.com/cdn/shop/products/DSC_5390_cf6118d2-9cd2-4aa6-b9a3-1b73327d0234.jpg?v=1654392174, https://midcenturymobler.com/cdn/shop/products/DSC_5394_812df1a1-ddb7-43c9-923c-44c0c1e4b6fb.jpg?v=1654392175, https://midcenturymobler.com/cdn/shop/products/DSC_5396_72856dc7-ca5e-4127-9cad-4e48934c8451.jpg?v=1654392175, https://midcenturymobler.com/cdn/shop/products/DSC_5400_19576c60-4f81-41b6-b64c-fffdccb40302.jpg?v=1654392173, https://midcenturymobler.com/cdn/shop/products/DSC_5408_6b487334-5e80-4a09-8fc4-998dfb78e110.jpg?v=1654392174, https://midcenturymobler.com/cdn/shop/products/DSC_5412.jpg?v=1654392173, https://midcenturymobler.com/cdn/shop/products/DSC_5416_1349d0da-de8b-4038-b34b-f489a272cf4e.jpg?v=1654392173"
G Plan Fresco Lingerie Dresser #1,6710003368068,1250.0,,storage,,"This English modern G Plan Fresco lingerie chest was designed by Victor Wilkins in the 1960s. This fantastic dresser features six deep drawers with solid teak drawer fronts and carved afrormosia pulls. With its slender design, this piece is perfect for any space. In excellent original condition with typical wear for its vintage. MEASUREMENTS: 22″ wide x 18″ deep x 40.5″ tall. Drawer Interior: 19.5″ wide x 15″ deep x 4.5″ tall",22,40.5,18,"depth:18, dresser, g plan, height:40.5, teak, width: 22",,,"https://midcenturymobler.com/cdn/shop/products/DSC_0900_5c1800f1-a840-4f8d-903a-dca316b048ad.jpg?v=1642586610, https://midcenturymobler.com/cdn/shop/products/DSC_0963_d96e90e2-ce43-4ce1-97ba-c400063eb453.jpg?v=1642586610, https://midcenturymobler.com/cdn/shop/products/DSC_0968_10dfe96a-4a85-4794-b374-e1fdabb5dbbc.jpg?v=1642586610, https://midcenturymobler.com/cdn/shop/products/DSC_0972_ad5a8ba7-8d50-45b2-93e7-117cc1cbecfc.jpg?v=1642586610, https://midcenturymobler.com/cdn/shop/products/DSC_0975.jpg?v=1642586610, https://midcenturymobler.com/cdn/shop/products/DSC_0977.jpg?v=1642586611, https://midcenturymobler.com/cdn/shop/products/DSC_0984.jpg?v=1642586611, https://midcenturymobler.com/cdn/shop/products/DSC_0989.jpg?v=1642586611, https://midcenturymobler.com/cdn/shop/products/DSC_0991.jpg?v=1642586611, https://midcenturymobler.com/cdn/shop/products/DSC_0995.jpg?v=1642586611"
Frode Holm Vanity Chair In Teak + White Boucle,7214585151620,1625.0,,seating,STOOL,"Origin: DenmarkDesigner: Frode HolmManufacturer: UnknownEra: 1950sMaterials: Teak, ShearlingMeasurements: 29"" wide x 16"" deep x 29"" tall, Seat: 17"" tall Condition: In excellent original condition with vintage wear to the fabric. Can be recovered in new material for additional cost.",29,29,16,"danish, depth:16, frode holm, height:29, modern, seat:17, vanity, vanity chair, vanity stool, vintage, width:29",,,"https://midcenturymobler.com/cdn/shop/files/DSC_7424_b517d8d6-661f-423d-86db-3a6ca33a7556.jpg?v=1704398045, https://midcenturymobler.com/cdn/shop/files/DSC_7426_6948537c-4910-4985-92af-25b699d1455c.jpg?v=1704398044, https://midcenturymobler.com/cdn/shop/files/DSC_7428_36cd64e9-2e80-4485-9e74-28ea9d9d9b3f.jpg?v=1704398044, https://midcenturymobler.com/cdn/shop/files/DSC_7429_16aac15f-fdaa-45fc-907a-48be04fdc13b.jpg?v=1704398045, https://midcenturymobler.com/cdn/shop/files/DSC_7432_92f62073-af0a-423d-ba5c-2cd0fcd8f604.jpg?v=1704398043, https://midcenturymobler.com/cdn/shop/files/DSC_7434_263517da-3e12-4d01-82e7-58f81692662a.jpg?v=1704398046, https://midcenturymobler.com/cdn/shop/files/DSC_7436.jpg?v=1704398047, https://midcenturymobler.com/cdn/shop/files/DSC_7422_f5d4bf8c-0d31-422b-8eb5-ec0a5547fe07.jpg?v=1704398045"
Floating Mahogany Credenza By Elliotts Of Newbury,7207004700804,3965.0,,storage,CREDENZA,"Origin: EnglandDesigner: UnknownManufacturer: Elliotts Of NewburyEra: 1960sMaterials: Mahogany, TolaMeasurements: 77"" wide x 17.75"" deep x 30"" tallCondition: In excellent original condition with typical wear for its vintage. Price includes restoration / refinishing to remove all cosmetic wear.",77,30,17.75,"cabinet, credenza, Credenzas, depth:17.75, england, eon, floating, height:30, mahogany, tola, vintage, width:77",,,"https://midcenturymobler.com/cdn/shop/files/DSC_8308.png?v=1709264770, https://midcenturymobler.com/cdn/shop/files/DSC_8317.png?v=1709264782, https://midcenturymobler.com/cdn/shop/files/DSC_8320.png?v=1709264782, https://midcenturymobler.com/cdn/shop/files/DSC_8325.png?v=1709264782, https://midcenturymobler.com/cdn/shop/files/DSC_8327.png?v=1709264782, https://midcenturymobler.com/cdn/shop/files/DSC_8330.png?v=1709264782, https://midcenturymobler.com/cdn/shop/files/DSC_8335.png?v=1709264782"
Unique Corner Writing Desk In Mahogany By Wrighton,7198013587588,1975.0,,tables,DESK,"Origin: EnglandDesigner: UnknownManufacturer: Wrighton FurnitureEra: 1960sMaterials: MahoganyMeasurements: 36″ wide (front left to front right corner) x 25″ deep (center front to back corner), 25.5"" deep (left / right corner to back corner) x 43"" tall (to top of tambour storage cubby) 30″ tall (desk height) Condition: In excellent original condition with some patina. Price includes a full restoration / refinishing to remove all cosmetic wear Lead time for restoration: 7 - 8 weeks",36,43,25,"corner, corner desk, corner unit, depth:25, height:43.5, width:36, wrighton",,,"https://midcenturymobler.com/cdn/shop/files/DSC_5701_8ddc129c-65e3-44b7-b96a-ce9ffd35d6b6.jpg?v=1699214911, https://midcenturymobler.com/cdn/shop/files/DSC_5707.jpg?v=1699214912, https://midcenturymobler.com/cdn/shop/files/DSC_5712_b70495ba-fc06-43da-9bb3-60f413e692e1.jpg?v=1699214913, https://midcenturymobler.com/cdn/shop/files/DSC_5715_008f7316-549a-4b61-8084-711bc27853fa.jpg?v=1699214911, https://midcenturymobler.com/cdn/shop/files/DSC_5716.jpg?v=1699214912, https://midcenturymobler.com/cdn/shop/files/DSC_5721_6285304c-e30e-4e9f-8e96-9316cc118551.jpg?v=1699214913, https://midcenturymobler.com/cdn/shop/files/DSC_5728_3feb457f-f219-4b26-9e13-c2eb597cd1e5.jpg?v=1699214912, https://midcenturymobler.com/cdn/shop/files/DSC_5731_ced6d59e-6634-4079-a761-7fdf11540293.jpg?v=1699214914, https://midcenturymobler.com/cdn/shop/files/DSC_5735_5425c346-e06f-4b75-ae1c-bfdf1637c940.jpg?v=1699214911"
Brazilian Rosewood Highboy Dresser By Svend Langkilde,7035430469764,5500.0,,storage,HIGHBOY DRESSER,"Origin: Denmark. Designer: Svend Langkilde. Manufacturer: Langkilde Møbler. Era: 1960s. Materials: Rosewood. Measurements: 33"" wide x 17.5"" deep x 45"" tall Condition: In excellent original condition with light vintage wear. Price includes restoration. Lead time for restoration: 8 - 10 weeks",33,45,17.5,"BRAZILIAN ROSEWOOD, DA12877, DANISH MODERN, Denmark, depth:17.5, dresser, height:45, HIGHBOY DRESSER, Rosewood, svend langkilde, width:33",Langkilde Møbler,Svend Langkilde,"https://midcenturymobler.com/cdn/shop/products/DSC_7543_25daf115-7268-4e6c-a4d4-c8c894693a44.jpg?v=1671221919, https://midcenturymobler.com/cdn/shop/products/DSC_7535_85e73152-ed23-45a0-aee6-876128bc24b3.jpg?v=1671221919, https://midcenturymobler.com/cdn/shop/products/DSC_7536.jpg?v=1671221919, https://midcenturymobler.com/cdn/shop/products/DSC_7547_ec77e49d-7f51-442f-a351-8c896fe1c2aa.jpg?v=1671221917, https://midcenturymobler.com/cdn/shop/products/DSC_7552_d24c7491-3ea6-4643-9188-e9d60cbbe543.jpg?v=1671221918"
Teak Nightstand By Børge Mogensen,6746950697092,1500.0,,storage,Cabinets & Storage,"Origin: Denmark. Designer: Børge Mogensen. Manufacturer: Søborg Møbler. Era: 1952. Materials: Teak, Oak. Measurements: 18.5″ wide x 12.5″ deep x 21.5″ tall Condition: In excellent original condition with some light vintage wear Restoration Includes:. • Refinish in oil or lacquer",18.5,21.5,12.5,"Børge mogensen, chest, depth:12.5, dresser, gentleman's, height:21.5, nightstand, width:18.5",Søborg Møbler,Børge Mogensen,"https://midcenturymobler.com/cdn/shop/products/DSC_2416_affc5a0e-ecc8-479d-9acf-157737044b4e.jpg?v=1646077758, https://midcenturymobler.com/cdn/shop/products/DSC_2433_0dff3a52-08cb-4a7f-a813-964a565d8705.jpg?v=1646077758, https://midcenturymobler.com/cdn/shop/products/DSC_2439_52fb6e4b-bf51-4532-b321-a42990b92248.jpg?v=1646077758"
Johannes Andersen Rosewood Coffee Table With Drawers,6710738321540,2735.0,,tables,Cabinets & Storage,Origin: Denmark. Designer: Johannes Andersen. Manufacturer: Uldum. Era: 1960s. Materials: Rosewood. Measurements: 62.5″ wide x 25.5″ deep x 20.5″ tall Condition: In excellent original condition.,62.5,20.5,25.5,"coffee table, COFFEE TABLE WITH DRAWERS, denmark, depth:25.5, drawers, height:20.5, JOHANNES ANDERSEN, rosewood, table, uldum, width:62.5",Uldum,Johannes Andersen,"https://midcenturymobler.com/cdn/shop/products/DA12381.jpg?v=1642634633, https://midcenturymobler.com/cdn/shop/products/DA12381f.jpg?v=1642634633, https://midcenturymobler.com/cdn/shop/products/DA12381e.jpg?v=1642634633, https://midcenturymobler.com/cdn/shop/products/DA12381d.jpg?v=1642634633, https://midcenturymobler.com/cdn/shop/products/DA12381b.jpg?v=1642634633, https://midcenturymobler.com/cdn/shop/products/DA12381c.jpg?v=1642634633"
