title,sku,price,retail_price,category,sub_category,description,width,height,depth,tags,brand,designer,images
1960S Swedish Modern Geometric Tile Top Coffee Table,6710687563908,1450.0,1850.0,tables,Tables,"Origin: Sweden. Designer: Unknown. Manufacturer: Unknown. Era: 1950s. Materials: Steel, Tile. Measurements: 45.5″ wide x 21.5″ deep x 23.5″ tall Condition: In great original condition with light vintage wear",45.5,23.5,21.5,"atomic, coffee table, depth:21.5, dresser, height:23.5, sale, teak, torvits, width:45.5",,,"https://midcenturymobler.com/cdn/shop/products/DA11926.jpg?v=1642627824, https://midcenturymobler.com/cdn/shop/products/DA11926b.jpg?v=1642627825, https://midcenturymobler.com/cdn/shop/products/DA11926c.jpg?v=1642627825"
Small English Modern Tambour Teak Credenza,7207037567108,3800.0,,storage,CREDENZA,"Origin: DenmarkDesigner: UnknownManufacturer: DalescraftEra: 1960sMaterials: TeakMasurements: 66"" wide x 18"" deep x 31"" tall Condition: In excellent original condition with typical wear for its vintage. Price includes restoration / refinishing to remove all cosmetic wear.",66,31,18,"1960s, arne vodder, credenza, denmark, depth:18, ENGLAND - JANUARY 2024, height:31, PRE-ORDER, sibast, teak, width:66",,,"https://midcenturymobler.com/cdn/shop/files/DSC_8067.png?v=1709183686, https://midcenturymobler.com/cdn/shop/files/DSC_8074.png?v=1709183687, https://midcenturymobler.com/cdn/shop/files/DSC_8078.png?v=1709183688, https://midcenturymobler.com/cdn/shop/files/DSC_8081.png?v=1709183685, https://midcenturymobler.com/cdn/shop/files/DSC_8086.png?v=1709183688, https://midcenturymobler.com/cdn/shop/files/DSC_8088.png?v=1709183689, https://midcenturymobler.com/cdn/shop/files/DSC_8096.png?v=1709183686"
Set Of Four Paolo Buffa Highback Chiavari Dining Chairs,7104539263108,4100.0,,seating,DINING CHAIR,"This set of four Paolo Buffa Chiavari chairs is an excellent addition to any modern dining room. Crafted with a strong, lightweight frame in a rare, unique design, these chairs are both stylish and sturdy. Origin: Italy. Designer: Paolo Buffa. Manufacturer: Chiavari. Era: 1960s. Materials: Mahogany. Measurements: 18″ wide x 17″ deep x 52.5″ tall Seat: 19″ tall Condition: In excellent condition. New upholstery.",18,52.5,17,"chiavari, depth:17, dining, height:52.5, highback, Italy, iversen, mahogany, paolo buffa, width:18",Chiavari,Paolo Buffa,"https://midcenturymobler.com/cdn/shop/files/163A8135.jpg?v=1682386091, https://midcenturymobler.com/cdn/shop/files/163A8133.jpg?v=1682386091, https://midcenturymobler.com/cdn/shop/files/163A8136.jpg?v=1682386085, https://midcenturymobler.com/cdn/shop/files/163A8140.jpg?v=1682386085, https://midcenturymobler.com/cdn/shop/files/163A8141.jpg?v=1682386085, https://midcenturymobler.com/cdn/shop/files/163A8144.jpg?v=1682386085, https://midcenturymobler.com/cdn/shop/files/163A8147.jpg?v=1682386085, https://midcenturymobler.com/cdn/shop/files/163A8148.jpg?v=1682386085, https://midcenturymobler.com/cdn/shop/files/163A8151.jpg?v=1682386085"
Mcintosh Dunotter Credenza In Rosewood,7206887358596,4800.0,,storage,CREDENZA,Origin: ScotlandDesigner: Val RossiManufacturer: A.H. McIntoshEra: 1960sMaterials: RosewoodMeasurements: 84″ wide x 18″ deep x 30″ tallCondition: In excellent original condition with typical wear for its vintage Price includes restoration / refinishing to remove all cosmetic wear.,84,30,18,"1960s, A.H. McIntosh, credenza, depth:18, ENGLAND - JANUARY 2024, height:30, PRE-ORDER, rosewood, Scotland, Val Rossi, width:84",,,"https://midcenturymobler.com/cdn/shop/files/DSC_8663.png?v=1709268140, https://midcenturymobler.com/cdn/shop/files/DSC_8669.png?v=1709268151, https://midcenturymobler.com/cdn/shop/files/DSC_8672.png?v=1709268151, https://midcenturymobler.com/cdn/shop/files/DSC_8675.png?v=1709268151, https://midcenturymobler.com/cdn/shop/files/DSC_8679.png?v=1709268151, https://midcenturymobler.com/cdn/shop/files/DSC_8685.png?v=1709268151, https://midcenturymobler.com/cdn/shop/files/DSC_8687.png?v=1709268151, https://midcenturymobler.com/cdn/shop/files/DSC_8688.png?v=1709268151, https://midcenturymobler.com/cdn/shop/files/DSC_8693_e58d17a6-b347-4da1-b070-94a346a625c8.jpg?v=1709268151, https://midcenturymobler.com/cdn/shop/files/DSC_8696.png?v=1709268151, https://midcenturymobler.com/cdn/shop/files/DSC_8700.png?v=1709268151, https://midcenturymobler.com/cdn/shop/files/DSC_8707.png?v=1709268151, https://midcenturymobler.com/cdn/shop/files/DSC_8710.png?v=1709268151"
Space Age Ufo Floor Lamp By Fog + Morup #3,6710714695812,2200.0,,lighting,lighting,"Origin: Denmark. Designer: Unknown. Manufacturer: Fog + Morup. Era: 1960s. Materials: Steel, Plastic. Measurements: 20.5″ diameter x 51.5″ tall Condition: In excellent original condition.",,51.5,,"1960s, AGE, denmark, diameter, diameter:20.5, floor, fog, FOG + MORUP, height:51.5, lamp, model, modern, morup, October 2021, plastic, PRE-ORDER, SPACE, space age, SPACE AGE UFO FLOOR LAMP, steel, ufo, UFO FLOOR",Fog + Morup,,https://midcenturymobler.com/cdn/shop/products/DA12202.jpg?v=1642632035
Space Age Ufo Floor Lamp By Fog + Morup #2,6710714597508,2200.0,,lighting,lighting,"Origin: Denmark. Designer: Unknown. Manufacturer: Fog + Morup. Era: 1960s. Materials: Steel, Plastic. Measurements: 20.5″ diameter x 51.5″ tall Condition: In excellent original condition.",,51.5,,"1960s, AGE, denmark, diameter, diameter:20.5, floor, fog, FOG + MORUP, height:51.5, lamp, model, modern, morup, October 2021, plastic, PRE-ORDER, SPACE, space age, SPACE AGE UFO FLOOR LAMP, steel, ufo, UFO FLOOR",Fog + Morup,,https://midcenturymobler.com/cdn/shop/products/DA12201.jpg?v=1642632029
Ole Wanscher Model Fd-159 Highback Lounge Chair In Teak + Leather,6710750347396,3675.0,,seating,Cabinets & Storage,"Origin: Denmark. Designer: Ole Wanscher. Manufacturer: France + Daverkosen. Era: 1950s. Materials: Teak, Leather. Measurements: 26.5"" wide x 29"" deep x 41.25″ talll, Seat: 16"" tall Condition: In excellent original condition.",26.5,41.25,29,"1950s, chair, danish modern, denmark, France + Daverkosen, height:41.25, Highback Lounge Chair, leather, lounge chair, MODEL FD-159, ole wanscher, teak",France + Daverkosen,Ole Wanscher,"https://midcenturymobler.com/cdn/shop/products/DA12489.jpg?v=1642635931, https://midcenturymobler.com/cdn/shop/products/DA12489g.jpg?v=1642635931, https://midcenturymobler.com/cdn/shop/products/DA12489d.jpg?v=1642635931, https://midcenturymobler.com/cdn/shop/products/DA12489e.jpg?v=1642635931, https://midcenturymobler.com/cdn/shop/products/DA12489b.jpg?v=1642635931, https://midcenturymobler.com/cdn/shop/products/DA12489c.jpg?v=1642635931"
Swedish Modern Rolling Bar Cabinet / Coffee Table In Rosewood,7190164570244,2450.0,,storage,COFFEE TABLE,Origin: SwedenDesigner: Gillis LundgrenManufacturer: IKEAEra: 1960sMaterials: RosewoodMeasurements: 27.5″ wide x 27.5″ deep x 18″ tall Condition: In excellent original condition with typical wear for its vintage.,27.5,18,27.5,"1960s, BAR CABINET, coffee table, DENMARK - JANUARY 2024, depth:27.5, Gillis Lundgren, height:18, ikea, PRE-ORDER, rosewood, sweden, width:27.5",,,"https://midcenturymobler.com/cdn/shop/files/DA13180.jpg?v=1698159894, https://midcenturymobler.com/cdn/shop/files/DA13180a.jpg?v=1698159895, https://midcenturymobler.com/cdn/shop/files/DA13180d.jpg?v=1698159893, https://midcenturymobler.com/cdn/shop/files/DA13180b.jpg?v=1698159894, https://midcenturymobler.com/cdn/shop/files/DA13180c.jpg?v=1698159894"
Organic Swedish Modern Teak + Black Lacquer Wall Mirror,7125811396740,975.0,,accessories,WALL MIRROR,"Origin: Sweden. Designer: Unknown. Manufacturer: Glas &amp; Trä Hovmantorp. Era: 1960s. Materials: Teak, Glass. Measurements: 20.5″ wide x 33.5″ tall Condition: In excellent original condition with typical wear for its vintage.",20.5,33.5,,"1960s, 2023, BLACK LACQUER, DA13134, DANISH MODERN, Denmark, Glass, height:33.5, mirror, MODERN, ORGANIC, PRE ORDER, SWEDISH, TEAK, WALL MIRROR, width:20.5",Glas & Trä Hovmantorp,,"https://midcenturymobler.com/cdn/shop/files/DA13134.jpg?v=1688374160, https://midcenturymobler.com/cdn/shop/files/DA13134e.jpg?v=1688374167, https://midcenturymobler.com/cdn/shop/files/DA13134b.jpg?v=1688374167, https://midcenturymobler.com/cdn/shop/files/DA13134c.jpg?v=1688374167, https://midcenturymobler.com/cdn/shop/files/DA13134d.jpg?v=1688374168, https://midcenturymobler.com/cdn/shop/files/DA13134f.jpg?v=1688374168"
Pair Of Rosewood Bookcases By Lyby Møbler,6969495486596,5950.0,,storage,BOOKCASES,Origin: Denmark. Designer: Unknown. Manufacturer: Lyby Møbler. Era: 1960s. Materials: Rosewood. Measurements: 35.5″ wide x 17″ deep x 63″ tall Condition: In excellent original condition.,35.5,63,17,"1960s, 2023, BOOKCASES, DA12866, Denmark, depth:17, height:63, JANUARY 2023, Lyby Møbler, PAIR, Rosewood, width:35.5",Lyby Møbler,,"https://midcenturymobler.com/cdn/shop/products/DA12866.jpg?v=1664080898, https://midcenturymobler.com/cdn/shop/products/DA12866d.jpg?v=1664080913, https://midcenturymobler.com/cdn/shop/products/DA12866f.jpg?v=1664080914, https://midcenturymobler.com/cdn/shop/products/DA12866g.jpg?v=1664080916, https://midcenturymobler.com/cdn/shop/products/DA12866e.jpg?v=1664080915, https://midcenturymobler.com/cdn/shop/products/DA12866b.jpg?v=1664080914, https://midcenturymobler.com/cdn/shop/products/DA12866c.jpg?v=1664080914, https://midcenturymobler.com/cdn/shop/products/DA12866h.jpg?v=1664080915"
Rotating Bookcase / Bar Cabinet By Sola Møbelfabrik,7190261006468,2100.0,,storage,BAR CABINET,Origin: NorwayDesigner: UnknownManufacturer: Sola MøbelfabrikEra: 1950sMaterials: TeakMeasurements: 44″ wide x 31.5″ deep x 24.5″ tall Condition: In excellent original condition with typical wear for its vintage.,44,24.5,31.5,"1950s, BAR CABINET, DENMARK - JANUARY 2024, depth:31.5, height:24.5, norway, ROTATING BOOKCASE, Sola Møbelfabrik, teak, width:44",,,"https://midcenturymobler.com/cdn/shop/files/DA13189.jpg?v=1698164637, https://midcenturymobler.com/cdn/shop/files/DA13189b.jpg?v=1698164638, https://midcenturymobler.com/cdn/shop/files/DA13189c.jpg?v=1698164636, https://midcenturymobler.com/cdn/shop/files/DA13189cc.jpg?v=1698164637"
Large Teak Credenza By Henry Rosengren Hansen,7015323795588,8500.0,,storage,CREDENZA,Origin: Denmark. Designer: Henry Rosengren Hansen. Manufacturer: Brande Møbelindustri. Era: 1960s. Materials: Teak. Measurements: 94.5″ wide x 18.75″ deep x 31.5″ tall Condition: In excellent original condition.,94.5,31.5,18.75,"1960s, 2023, Brande Møbelindustri, CREDENZA, DA12930, DANISH MODERN, DENMARK, DENMARK JANUARY 2023, depth:18.75, height:31.5, Henry Rosengren Hansen, JANUARY 2023, LARGE, MASSIVE BRAZILIAN, Teak, width:94.5",Brande Møbelindustri,Henry Rosengren Hansen,"https://midcenturymobler.com/cdn/shop/products/DA12930.jpg?v=1667969393, https://midcenturymobler.com/cdn/shop/products/DA12930d.jpg?v=1667969403, https://midcenturymobler.com/cdn/shop/products/DA12930e.jpg?v=1667969404, https://midcenturymobler.com/cdn/shop/products/DA12930f.jpg?v=1667969404, https://midcenturymobler.com/cdn/shop/products/DA12930h.jpg?v=1667969403, https://midcenturymobler.com/cdn/shop/products/DA12930i.jpg?v=1667969406, https://midcenturymobler.com/cdn/shop/products/DA12930k.jpg?v=1667969405, https://midcenturymobler.com/cdn/shop/products/DA12930j.jpg?v=1667969404, https://midcenturymobler.com/cdn/shop/products/DA12930l.jpg?v=1667969406, https://midcenturymobler.com/cdn/shop/products/DA12930b.jpg?v=1667969405, https://midcenturymobler.com/cdn/shop/products/DA12930c.jpg?v=1667969404"
Borge Mogensen Tall Teak Cupboard,6710610526340,4200.0,,storage,Cabinets & Storage,Origin: Denmark. Designer: Borge Mogensen. Manufacturer: Søborg Møbler. Era: 1960s. Materials: Teak. Measurements: 47.5″ wide x 16″ deep x 58″ tall Condition: In great original condition with some light cosmetic wear (will be addressed in restoration) Restoration Includes:. • Structural + joint repair (if necessary) on all joints. • Full refinish in matte lacquer,47.5,58,16,"borge mogensen, depth:16, dresser, height:58, mogensen, teak, width:47.5",Søborg Møbler,Borge Mogensen,"https://midcenturymobler.com/cdn/shop/products/IMG_0039.jpg?v=1642624638, https://midcenturymobler.com/cdn/shop/products/IMG_0040.jpg?v=1642624638, https://midcenturymobler.com/cdn/shop/products/IMG_0042.jpg?v=1642624638"
Six Piece 1970S Modular German Space Age Sofa,6968936792196,6785.0,,seating,SOFA,"Origin: Germany. Designer: Unknown. Manufacturer: Unknown. Era: 1970s. Materials: Fabric, Plastic, Wool. Measurements: 27.5″ wide x 35.5″ deep x 15.25″ tall Condition: In excellent original condition with typical wear for its vintage.",27.5,15.25,35.5,"1970s, 2023, DA12860, depth:35.5, Fabric, height:15.25, JANUARY 2023, MODULAR GERMAN, Plastic, SIX PIECE, width:27.5, Wool",,,"https://midcenturymobler.com/cdn/shop/products/DA12860a.jpg?v=1664480739, https://midcenturymobler.com/cdn/shop/products/DA12860eeee.jpg?v=1664480739, https://midcenturymobler.com/cdn/shop/products/DA12860l.jpg?v=1664480739, https://midcenturymobler.com/cdn/shop/products/DA12860d.jpg?v=1664480739, https://midcenturymobler.com/cdn/shop/products/DA12860gg.jpg?v=1664480739, https://midcenturymobler.com/cdn/shop/products/DA12860h.jpg?v=1664480739, https://midcenturymobler.com/cdn/shop/products/DA12860i.jpg?v=1664480739, https://midcenturymobler.com/cdn/shop/products/DA12860b.jpg?v=1664018993, https://midcenturymobler.com/cdn/shop/products/DA12860c.jpg?v=1664018996, https://midcenturymobler.com/cdn/shop/products/DA12860dd.jpg?v=1664018996, https://midcenturymobler.com/cdn/shop/products/DA12860ee.jpg?v=1664018996, https://midcenturymobler.com/cdn/shop/products/DA12860eee.jpg?v=1664018995, https://midcenturymobler.com/cdn/shop/products/DA12860eeeee.jpg?v=1664018994, https://midcenturymobler.com/cdn/shop/products/DA12860g.jpg?v=1664018997, https://midcenturymobler.com/cdn/shop/products/DA12860j.jpg?v=1664018994, https://midcenturymobler.com/cdn/shop/products/DA12860k.jpg?v=1664018997"
Highback Winged Falcon Chair In Rust Leather,7244636291204,2500.0,,seating,LOUNGE CHAIR,"Origin: NorwayDesigner: Sigurd RessellManufacturer: Vatne MøblerEra: 1960sMaterials: Leather, Bent BeechMeasurements: 32″ wide x 33″ deep x 39.5″ tallSeat Height: 18″ tall Condition: In excellent original condition.",32,39.5,33,"depth:33, falcon, height:39.5, highback, lounge, norway, norwegian, vatne, width:32, winged",,,"https://midcenturymobler.com/cdn/shop/files/DSC_0561.jpg?v=1711166613, https://midcenturymobler.com/cdn/shop/files/DSC_0543.jpg?v=1711166615, https://midcenturymobler.com/cdn/shop/files/DSC_0540.jpg?v=1711166614, https://midcenturymobler.com/cdn/shop/files/DSC_0548.jpg?v=1711166613, https://midcenturymobler.com/cdn/shop/files/DSC_0550.jpg?v=1711166612, https://midcenturymobler.com/cdn/shop/files/DSC_0554.jpg?v=1711166616, https://midcenturymobler.com/cdn/shop/files/DSC_0556.jpg?v=1711166614, https://midcenturymobler.com/cdn/shop/files/DSC_0565.jpg?v=1711166612"
Set Of Six Pj 3-2 Teak Dining Chairs By Grete Jalk,7218407014532,8400.0,,seating,DINING CHAIR,"Origin: DenmarkDesigner: Grete JalkManufacturer: Poul JeppsenEra: 1950sMaterials: TeakMeasurements: 19.75"" wide x 19"" deep x 30"" tall Condition: In good original condition with vintage wear. Price includes refinishing of frames and new upholstery in your choice of fabric. Restoration Includes:• Structural + joint repair (if necessary) on all joints• Refinish all wood surfaces in lacquer• New custom upholstery with fresh foam and material (inquire for available fabrics and physical samples) Fabrics recommend for upholstery: HallingdalTonusTonicaClaraDivina MD",19.75,30,19,"1950s, denmark, DENMARK - JANUARY 2024, depth:19, grete jalk, height:30, Poul Jeppsen, PRE-ORDER, SET OF SIX PJ 3-2 TEAK DINING CHAIRS, teak, width:19.75",,,"https://midcenturymobler.com/cdn/shop/files/DA13226.jpg?v=1705400132, https://midcenturymobler.com/cdn/shop/files/DA13226c.jpg?v=1705400131, https://midcenturymobler.com/cdn/shop/files/DA13226b.jpg?v=1705400133, https://midcenturymobler.com/cdn/shop/files/DA13226bb.jpg?v=1705400132, https://midcenturymobler.com/cdn/shop/files/DA13226d.jpg?v=1705400130, https://midcenturymobler.com/cdn/shop/files/DA13226e.jpg?v=1705400131, https://midcenturymobler.com/cdn/shop/files/DA13226f.jpg?v=1705400130"
"Danish Modern ""Pipe-Dan"" Pipe Cabinet In Teak",6710712959108,1850.0,,storage,Cabinets & Storage,Origin: Denmark. Designer: Unknown. Manufacturer: Unknown. Era: 1950s. Materials: Teak. Measurements: 19.75″ wide x 7.75″ deep x 27.5″ tall Condition: In excellent original condition.,19.75,27.5,7.75,"1950s, cabinet, danish, danish modern, denmark, depth:7.75, height:27.5, modern, October 2021, PIPE, PIPE CABINET, PIPE-DAN, PRE-ORDER, teak, width:19.75",,,"https://midcenturymobler.com/cdn/shop/products/DA12187.jpg?v=1642631867, https://midcenturymobler.com/cdn/shop/products/DA12187c.jpg?v=1642631867, https://midcenturymobler.com/cdn/shop/products/DA12187b.jpg?v=1642631867, https://midcenturymobler.com/cdn/shop/products/DA12187d.jpg?v=1642631867"
Rare Fifteen Drawer Low Dresser In Rosewood By Kai Winding,7218129928324,6500.0,,storage,DRAWER CHEST,"Origin: DenmarkDesigner: Kai WindingManufacturer: Willy BeckEra: 1960sMaterials: RosewoodMeasurements: 64.75"" wide x 15.75"" deep x 27"" tallCondition: In excellent original condition with typical wear for its vintage.",64.75,27,15.75,"1960s, denmark, DENMARK - JANUARY 2024, depth:15.75, height:27, kai winding, PRE-ORDER, RARE FIFTEEN DRAWER LOW DRESSER IN ROSEWOOD BY KAI WINDING, rosewood, width:64.75, Willy Beck",,,"https://midcenturymobler.com/cdn/shop/files/DSC_8264.png?v=1709264306, https://midcenturymobler.com/cdn/shop/files/DSC_8269.png?v=1709264357, https://midcenturymobler.com/cdn/shop/files/DSC_8274.png?v=1709264357, https://midcenturymobler.com/cdn/shop/files/DSC_8279.png?v=1709264357, https://midcenturymobler.com/cdn/shop/files/DSC_8285.png?v=1709264357, https://midcenturymobler.com/cdn/shop/files/DSC_8294.png?v=1709264357, https://midcenturymobler.com/cdn/shop/files/DSC_8296.png?v=1709264357, https://midcenturymobler.com/cdn/shop/files/DSC_8300.png?v=1709264357"
Tall Teak Credenza By E.W. Bach,7034383663236,2900.0,3800.0,storage,Cabinets & Storage,Origin: Denmark. Designer: E.W. Bach. Manufacturer: Sejling Skabe. Era: 1960s. Materials: Teak. Dimensions: 77” wide x 17” deep x 44.5” tall Condition: In excellent original condition,,44.5,17.5,"credenza, depth:17.5, e.w. bach, height:44.5, sale, tall",Sejling Skabe,E.W. Bach,"https://midcenturymobler.com/cdn/shop/products/ScreenShot2022-12-11at5.23.44PM.png?v=1670808505, https://midcenturymobler.com/cdn/shop/products/IMG_0206.jpg?v=1670808505, https://midcenturymobler.com/cdn/shop/products/IMG_0210.jpg?v=1670808505, https://midcenturymobler.com/cdn/shop/products/IMG_0215.jpg?v=1670808505, https://midcenturymobler.com/cdn/shop/products/IMG_0219_baad0529-8765-49a3-9f88-be4711c48333.jpg?v=1670808505, https://midcenturymobler.com/cdn/shop/products/IMG_0221.jpg?v=1670808505, https://midcenturymobler.com/cdn/shop/products/IMG_0222_759c333e-bfa2-4d2f-b6a3-cf9d993c5118.jpg?v=1670808505, https://midcenturymobler.com/cdn/shop/products/IMG_0223.jpg?v=1670808505, https://midcenturymobler.com/cdn/shop/products/IMG_0224.jpg?v=1670808505"
Model 166 Senator Lounge Chair By Ole Wanscher,7101123854468,3100.0,,seating,LOUNGE CHAIR,"Origin: Denmark. Designer: Ole Wanscher. Manufacturer: France + Søn. Era: 1960s. Materials: Teak. Measurements: 27″ wide x 28"" deep 30.75″ tall, Seat: 16.5"" tall Condition: In good original condition with vintage wear. Price includes refinishing of frames and new upholstery in your choice of fabric.",27,30.75,28,"1960s, 2023, chairs, DA13085, DANISH MODERN, Denmark, DINING CHAIRS, France + Søn, height:30.75, June2023, LOUNGE, LOUNGE CHAIR, May 2023, MODEL 166 SENATOR, OLE WANSCHER, TEAK, width:26.75",France + Søn,Ole Wanscher,"https://midcenturymobler.com/cdn/shop/products/DA13085.jpg?v=1681632227, https://midcenturymobler.com/cdn/shop/products/DA13085b.jpg?v=1681632272, https://midcenturymobler.com/cdn/shop/products/DA13085x.jpg?v=1681632272, https://midcenturymobler.com/cdn/shop/products/DA13085e.jpg?v=1681632272, https://midcenturymobler.com/cdn/shop/products/DA13085c.jpg?v=1681632272, https://midcenturymobler.com/cdn/shop/products/DA13085cc.jpg?v=1681632272, https://midcenturymobler.com/cdn/shop/products/DA13085d.jpg?v=1681632272"
"Set Of Six Neils Kofod ""Eva"" Highback Dining Chairs In Teak",7206865961092,4850.0,,seating,DINING CHAIR,Origin: DenmarkDesigner: Neils KofodManufacturer: Kofod Hornslet MøbelfabrikEra: 1960sMaterials: TeakMeasurements: 19″ wide x 17″ deep x 38″ tallCondition: In excellent original condition with typical wear for their vintage. Restoration Includes:. • Structural + joint repair (if necessary) on all joints. • Refinish all wood surfaces in lacquer or oil. • New custom upholstery with fresh foam and material (inquire for available fabrics and physical samples) Fabrics we recommend for upholstery: Hallingdal. Tonus. Tonica. Clara. Divina MD,19,38,17,"1960s, denmark, depth:17, ENGLAND - JANUARY 2024, height:38, HIGHBACK DINING CHAIRS, Kofod Hornslet Møbelfabrik, Neils Kofod, PRE-ORDER, teak, width:19",,,"https://midcenturymobler.com/cdn/shop/files/DSC_9916.jpg?v=1711164627, https://midcenturymobler.com/cdn/shop/files/DSC_9927.jpg?v=1711164634, https://midcenturymobler.com/cdn/shop/files/DSC_9930.jpg?v=1711164634, https://midcenturymobler.com/cdn/shop/files/DSC_9934.jpg?v=1711164634, https://midcenturymobler.com/cdn/shop/files/DSC_9940.jpg?v=1711164634, https://midcenturymobler.com/cdn/shop/files/DSC_9946.jpg?v=1711164634, https://midcenturymobler.com/cdn/shop/files/DSC_9949.jpg?v=1711164634, https://midcenturymobler.com/cdn/shop/files/DSC_9953.jpg?v=1711164634, https://midcenturymobler.com/cdn/shop/files/DSC_9956.jpg?v=1711164634, https://midcenturymobler.com/cdn/shop/files/DSC_9960.jpg?v=1712082720"
1950S Secretary Desk In Teak,6710737207428,2100.0,,storage,Cabinets & Storage,Origin: Denmark. Designer: Unknown. Manufacturer: Unknown. Era: 1960s. Materials: Teak. Measurements: 35″ wide x 18″ deep x 44.5″ tall Condition: In excellent original condition.,35,44.5,18,"1950s, 1960s, 2022, denmark, depth:18, desk, height:44.5, secretary, secretary desk, teak, width:35",,,"https://midcenturymobler.com/cdn/shop/products/DA12351.jpg?v=1642634487, https://midcenturymobler.com/cdn/shop/products/DA12351b.jpg?v=1642634487, https://midcenturymobler.com/cdn/shop/products/DA12351c.jpg?v=1642634487, https://midcenturymobler.com/cdn/shop/products/DA12351f.jpg?v=1642634487, https://midcenturymobler.com/cdn/shop/products/DA12351e.jpg?v=1642634487"
Psychedelic Folding 1960S Sunbed,7189670854788,950.0,,seating,SUNBED / LOUNGE,Origin: SwedenDesigner: UnknownManufacturer: UnknownEra: 1960sMaterials: AluminumMeasurements: 26″ wide x 67″ deep Condition: In good original condition.,26,,67,"1960s, aluminum, DENMARK - JANUARY 2024, depth:67, PRE-ORDER, PSYCHEDELIC FOLDING, SUNBED, sweden, width:26",,,"https://midcenturymobler.com/cdn/shop/files/DA13155.jpg?v=1698125970, https://midcenturymobler.com/cdn/shop/files/DA13155c.jpg?v=1698125970, https://midcenturymobler.com/cdn/shop/files/DA13155b.jpg?v=1698125969, https://midcenturymobler.com/cdn/shop/files/DA13155f.jpg?v=1698125969"
Circular Copper + Beech Motif Coffee Table By Oddmund Vad,7125847769220,2150.0,,tables,COFFEE TABLE,"Origin: Norway. Designer: Oddmund Vad. Manufacturer: VAD Trævarefabrik, Storda. Era: 1970s. Materials: Beech, Copper. Measurements: 43″ diameter x 21″ tall Condition: In excellent original condition with typical wear for its vintage.",43.5,21,43.5,"1970s, 2023, BEECH, CIRCULAR, COFFEE, COPPER, DA13143, DANISH MODERN, Denmark, Denmark- October 2023, depth:43.5, MOTIF, Norway, ODDMUND VAD, PRE ORDER, Storda, TABLE, VAD Trævarefabrik, width:43.5","VAD Trævarefabrik, Storda",Oddmund Vad,"https://midcenturymobler.com/cdn/shop/files/DA13143.jpg?v=1688380151, https://midcenturymobler.com/cdn/shop/files/DA13143g.jpg?v=1688380166, https://midcenturymobler.com/cdn/shop/files/DA13143b.jpg?v=1688380165, https://midcenturymobler.com/cdn/shop/files/DA13143c.jpg?v=1688380165, https://midcenturymobler.com/cdn/shop/files/DA13143d.jpg?v=1688380166, https://midcenturymobler.com/cdn/shop/files/DA13143e.jpg?v=1688380166, https://midcenturymobler.com/cdn/shop/files/DA13143f.jpg?v=1688380167"
